product_name,color,product_category,mrp,total_sizes,available_size,brand_name,retailer,description,pdp_url,rating,review_count,scrapping_datetime
Lace Underwired Bra,POWDER PINK,Lingerie,35,"32A,32B,32C,32D,32DD,34A,34B,34C,34D,34DD,36A,36B,36C,36D","32A,32B,32C,34A,34B,34C,34D",US TOPSHOP,Topshop US,"It’s all about delicate detail with this floral lace bra. With underwired for support, it provides a barely there feel without pads. 89% Nylon, 11% Elastane. Machine wash.",Lace Underwired Bra,NULL,NULL,26-04-20 19:42
Towelling Bodysuit,Bubblegum,Lingerie,35,"2,4,6,8,10,12,14","2,4,6,8,10,12,14",US TOPSHOP,Topshop US,"This bubblegum pink bodysuit is made from soft towelling for the ultimate in comfort. It's stylish too, with a scoop neckline. 80% Cotton, 20% Polyester. Machine wash.",Towelling Bodysuit,NULL,NULL,26-04-20 19:42
Plunge Bra by Mimi Holliday,WHITE,Lingerie,75,"32B,32C,32D,34B,34C,34D,36B,36C,36D","34B,36C",US TOPSHOP,Topshop US,"A flattering white plunge bra by Mimi Holliday. 90% Nylon, 10% Elastane. Machine wash.",Plunge Bra by Mimi Holliday,NULL,NULL,26-04-20 19:42
Ombre Mini Knickers,Bright Coral,Lingerie,10,"2,4,6,8,10","2,4,6,8,10",US TOPSHOP,Topshop US,"Keep your basics looking sporty with this bright coral thong that features Topshop branding detail. 94% Polyamide, 6% Elastane. Machine wash.",Ombre Mini Knickers,NULL,NULL,26-04-20 19:42
Lace Shortie Knickers by Bonds,TEAL,Lingerie,26,"4,6,8,10","4,6,8",US TOPSHOP,Topshop US,"Elevate your intimates with these lace shortie knickers by Bonds in teal. 88% Nylon,12% Elastane. Machine wash.",Lace Shortie Knickers by Bonds,NULL,NULL,26-04-20 19:42
Triangle Bra by Mimi Holliday,Nude,Lingerie,65,"XS,S,M,L","XS,S,M,L",US TOPSHOP,Topshop US,Nude triangle bra by Mimi Holliday. 100% Nylon. Machine wash.,Triangle Bra by Mimi Holliday,NULL,NULL,26-04-20 19:42
Knickers by Mimi Holliday,Nude,Lingerie,45,"XS,S,M,L","XS,S,M,L",US TOPSHOP,Topshop US,Nude knickers by Mimi Holliday. 100% Nylon. Machine wash.,Knickers by Mimi Holliday,NULL,NULL,26-04-20 19:42
Lace Mini Knickers by Mimi Holliday,BLACK,Lingerie,45,"XS,S,M,L","XS,S,M,L",US TOPSHOP,Topshop US,These lacy black mini knickers by Mimi Holliday will ensure you look your very best all the way down to your underwear. 100% Nylon. Machine wash.,Lace Mini Knickers by Mimi Holliday,NULL,NULL,26-04-20 19:42
3 Pack Disney Print Knickers,MULTI,Lingerie,10,"2,4,6,8,10,12,14",10,US TOPSHOP,Topshop US,"In three bright and colourful prints depicting some of our most-loved Walt Disney princesses, this pack of short knickers will brighten up your lingerie draw. 95% Cotton, 5% Elastane. Machine wash.",3 Pack Disney Print Knickers,NULL,NULL,26-04-20 19:42
Plunge Bra by Mimi Holliday,Nude,Lingerie,75,"32B,32C,32D,34B,34C,34D,36B,36C,36D","32B,32C,32D,34B,34C,34D,36B,36C,36D",US TOPSHOP,Topshop US,Nude plunge bra by Mimi Holliday. 100% Nylon. Machine wash.,Plunge Bra by Mimi Holliday,NULL,NULL,26-04-20 19:42
3 Pack Brazilian Knickers,MULTI,Lingerie,10,"2,4,6,8,10,12,14","2,4,8",US TOPSHOP,Topshop US,"A three-pack of Brazilian knickers in multi colours. 88% Polyamide, 12% Elastane. Machine wash.",3 Pack Brazilian Knickers,NULL,NULL,26-04-20 19:42
Underwired Lace Bra,AQUA,Lingerie,35,"32A,32B,32C,32D,34A,34B,34C,34D,36A,36B,36C,32DD","32A,32B,32C,32D,34A,34B,34C,34D,36A,36C",US TOPSHOP,Topshop US,"Aqua underwire lace bra. 89% Nylon,11% Elastane. Machine washable.",Underwired Lace Bra,NULL,NULL,26-04-20 19:42
Lace Thong,BURNT ORANGE,Lingerie,10,"2,4,6,8,10,12,14","2,4,6,8,10,12",US TOPSHOP,Topshop US,"Burnt orange lace thong. 89% Nylon, 11% Elastane. Machine wash.",Lace Thong,NULL,NULL,26-04-20 19:42
Padded Lace Bralet,Bubblegum Pi,Lingerie,30,"2,4,6,8,10,12,14","2,4,6,8,10,12",US TOPSHOP,Topshop US,"Bubblegum pink lace bralet with padded cups for extra support. 89% Nylon, 11% Elastane. Machine wash.",Padded Lace Bralet,NULL,NULL,26-04-20 19:42
Circle Mesh Bralet,BLACK,Lingerie,38,"2,4,6,8,10,12,14","2,4,6,8,10,12,14",US TOPSHOP,Topshop US,"Refresh your lingerie with this intricate mesh bralet. Styled with a deep V-neckline, reverse V-underband and contrast mesh patterning, you'll want to wear your underwear as outerwear from now on. 85% Polyamide, 15% Elastane. Machine wash.",Circle Mesh Bralet,NULL,NULL,26-04-20 19:42
Premium Applique Triangle Bra,CHARCOAL,Lingerie,50,"2,4,6,8,10,12,14","2,4,6,8,10,12,14",US TOPSHOP,Topshop US,Pretty premium triangle bra in charcoal with appliques and delicate lace detailing. 100% Polyamide. Machine wash.,Premium Applique Triangle Bra,NULL,NULL,26-04-20 19:42
Thong by Mimi Holliday,Nude,Lingerie,45,"XS,S,M,L","XS,S,M,L",US TOPSHOP,Topshop US,Nude thong by Mimi Holliday. 100% Nylon. Machine wash.,Thong by Mimi Holliday,NULL,NULL,26-04-20 19:42
MATERNITY Geometric Mesh Bra,BLACK,Lingerie,40,"34B,34C,34D,34DD,36B,36C,36D,36DD","34B,34C,34D,34DD,36B,36C,36DD",US TOPSHOP,Topshop US,"This black mesh maternity bra comes in a geometric detail with a contrast underband and plunge front. 81% Polyester, 19% Elastane. Machine wash.",MATERNITY Geometric Mesh Bra,NULL,NULL,26-04-20 19:42
'Topshop' Logo Seamless Bra,BLACK,Lingerie,20,"S,M,L","S,M,L",US TOPSHOP,Topshop US,"Fancy going seam-free for summer? This classic black seamless sports bra with 'Topshop' logo is a wardrobe staple this season. It's so good, we've put our name on it. 85% Polyamide, 13% Polyester, 2% Elastane. Machine wash.",'Topshop' Logo Seamless Bra,NULL,NULL,26-04-20 19:42
Monochrome Bikini Knickers by Bonds,Monochrome,Lingerie,26,"4,6,8,10,12","4,6,8,10,12",US TOPSHOP,Topshop US,"Replenish your underwear drawer with these monochrome bikini knickers by Bonds. Their wide band hugs the hips for a comfortable fit. 95% Cotton, 5% Elastane. Machine wash.",Monochrome Bikini Knickers by Bonds,NULL,NULL,26-04-20 19:42
Plunge Bra by Mimi Holliday,AQUA,Lingerie,75,"32B,32C,32D,34A,34B,34C,34D,36B","34C,36B",US TOPSHOP,Topshop US,Aqua lace plunge bra by Mimi Holliday.100% Nylon. Machine wash.,Plunge Bra by Mimi Holliday,NULL,NULL,26-04-20 19:42
Underwired Lace Bra,Bubblegum Pi,Lingerie,35,"32A,32B,32C,32D,32DD,34A,34B,34C,34D,36A,36B,36C","32A,32C,32D,34A,34B,36A",US TOPSHOP,Topshop US,"Bubblegum pink underwired lace bra. 89% Nylon,11% Elastane. Machine wash.",Underwired Lace Bra,NULL,NULL,26-04-20 19:42
Lace Mini Knickers,PLUM,Lingerie,10,"2,4,6,8,10,12,14","2,4,6,8,12,14",US TOPSHOP,Topshop US,"In a pretty lace and mesh design, these plum mini knickers are finished with a contrast waistband. 87% Nylon, 13% Elastane. Machine wash.",Lace Mini Knickers,NULL,NULL,26-04-20 19:42
Lace Balcony Bra,BURNT ORANGE,Lingerie,35,"32A,32B,32C,32D,32DD,34A,34B,34C,34D,36A,36B,36C","32A,32B,32C,32D,32DD,34A,34B,34C,34D,36A,36B",US TOPSHOP,Topshop US,"Burnt orange lace balcony bra. 89% Nylon, 11% Elastane. Machine wash.",Lace Balcony Bra,NULL,NULL,26-04-20 19:42
Topshop Logo Seamless Thong,BLACK,Lingerie,10,"S,M,L","S,M,L",US TOPSHOP,Topshop US,"Black seamless sporty thong with 'Topshop' logo detail. 85% Polyamide, 13% Polyester, 2 % Elastane. Machine wash.",Topshop Logo Seamless Thong,NULL,NULL,26-04-20 19:42
Lace Thong,NAVY BLUE,Lingerie,10,"2,4,6,8,10,12,14","2,4,6,8,10,12,14",US TOPSHOP,Topshop US,"Navy blue knickers finished with pretty lace and mesh. 89% Nylon, 11% Elastane. Machine wash.",Lace Thong,NULL,NULL,26-04-20 19:42
Mini Knickers by Mimi Holliday,AQUA,Lingerie,45,"XS,S,M,L","XS,S",US TOPSHOP,Topshop US,Aqua lace mini knickers by Mimi Holliday. 100% Nylon. Machine wash.,Mini Knickers by Mimi Holliday,NULL,NULL,26-04-20 19:42
Logo Waistband Knickers by Calvin Klein,KHAKI,Lingerie,38,"XS,S,M,L","S,L",US TOPSHOP,Topshop US,"These classic Calvin Klein knickers are crafted in a soft cotton modal blend with just the right amount of stretch for all day comfort. This khaki style is finished with an iconic branded logo underband. 53% Cotton, 35% Modal, 12% Elastane. Machine wash.",Logo Waistband Knickers by Calvin Klein,NULL,NULL,26-04-20 19:42
Lace Mini Knickers,POWDER PINK,Lingerie,10,"2,4,6,8,10,12,14","2,4,6,8,10,12",US TOPSHOP,Topshop US,"Powder pink lace mini knickers. 89% Nylon, 11% Elastane. Machine wash.",Lace Mini Knickers,NULL,NULL,26-04-20 19:42
Lace Bikini Knickers by Bonds,Sugar Pink,Lingerie,28,"4,6,8,10","6,8",US TOPSHOP,Topshop US,"Add a little feminine frill to your underwear drawer with these sugar pink lace bikini knickers by Bonds. Their thick band hugs the hips for a comfortable fit. 94% Nylon, 6% Elastane. Machine wash.",Lace Bikini Knickers by Bonds,NULL,NULL,26-04-20 19:42
Plunge Bra by Mimi Holliday,BLACK,Lingerie,75,"32B,32C,32D,34B,34C,34D,36B,36C","32C,34B,34C,36B",US TOPSHOP,Topshop US,Black plunge bra by Mimi Holliday .100% Nylon. Machine wash.,Plunge Bra by Mimi Holliday,NULL,NULL,26-04-20 19:42
Bikini Knickers by Dora Larsen,RED,Lingerie,60,"XS,S,M,L","XS,S,M,L",US TOPSHOP,Topshop US,"Soft mint mesh, fuchsia elastic and poppy red lace bikini knickers by Dora Larsen. 85% Nylon, 15% Elastane. Machine wash.",Bikini Knickers by Dora Larsen,NULL,NULL,26-04-20 19:42
Sporty Branded Thong,Grey Marl,Lingerie,10,"S,M,L","M,L",US TOPSHOP,Topshop US,"Keep your basics looking sporty with this grey marl thong with Topshop branded detail. 49% Polyamide, 39% Polyester, 12% Elastane. Machine wash.",Sporty Branded Thong,NULL,NULL,26-04-20 19:42
Lace Mini Knickers,TEAL,Lingerie,10,"2,4,6,8,10,12,14","2,4,6,8,10,12,14",US TOPSHOP,Topshop US,"Teal mini knickers with geometric lace. 85% Nylon, 15% Elastane. Machine wash.",Lace Mini Knickers,NULL,NULL,26-04-20 19:42
Lace Thong,AQUA,Lingerie,10,"2,4,6,8,10,12,14","2,4,6,8,10,12",US TOPSHOP,Topshop US,"Aqua lace thong. 89% Nylon, 11% Elastane. Machine wash.",Lace Thong,NULL,NULL,26-04-20 19:42
ELLE Bralet,CHARCOAL,Lingerie,45,"32A,32B,32C,32D,32DD,34A,34B,34C,34D,34DD,36A,36B,36C,36D","32A,32B,32C,32D,34A,34B,34C,34D,36A,36B,36C",US TOPSHOP,Topshop US,"Instantly elevate your intimates with this longline structured bralet. In a charcoal hue, it’s finished with underwired cups for extra support. 96% Polyester, 4% Elastane. Machine wash.",ELLE Bralet,NULL,NULL,26-04-20 19:42
Triangle Bra by Bonds,BLACK,Lingerie,28,"4,6,8,10","8,10",US TOPSHOP,Topshop US,"Black triangle bra by Bonds. 95% Cotton, 5% Elastane. Machine wash.",Triangle Bra by Bonds,NULL,NULL,26-04-20 19:42
Lace Mini Knickers,DUSTY LILAC,Lingerie,10,"2,4,6,8,10,12,14","2,4,6,8,10,12,14",US TOPSHOP,Topshop US,"In a pretty lace and mesh design, these dusty lilac mini knickers are finished with a contrast waistband. 87% Nylon, 13% Elastane. Machine wash.",Lace Mini Knickers,NULL,NULL,26-04-20 19:42
3 Pack Cotton Lace Mini Knickers,MULTI,Lingerie,10,"2,4,6,8,10,12,14","4,8,10,12",US TOPSHOP,Topshop US,"Three-pack of cotton lace mini knickers. 88% Polyamide, 12% Elastane. Machine wash.",3 Pack Cotton Lace Mini Knickers,NULL,NULL,26-04-20 19:42
Black Velvet Bralet by Y.A.S,BLACK,Lingerie,26,"XS,S,M,L,XL",XL,US TOPSHOP,Topshop US,"A black velvet bralet by Y.A.S. 95% Polyester, 5% Elastane. Machine wash.",Black Velvet Bralet by Y.A.S,NULL,NULL,26-04-20 19:42
All Over Lace Body,GINGER,Lingerie,40,"2,4,6,8,10,12,14",8,US TOPSHOP,Topshop US,"Keep your base layers luxe with this body in all-over ginger lace with lace-up detail to the front. 85% Nylon, 15% Elastane. Machine wash.",All Over Lace Body,NULL,NULL,26-04-20 19:42
Lace Mini Knickers,BLACK,Lingerie,10,"2,4,6,8,10,12,14","2,4,6,8,10,14",US TOPSHOP,Topshop US,"Black lace mini knickers. 89% Nylon, 11% Elastane. Machine wash.",Lace Mini Knickers,NULL,NULL,26-04-20 19:42
Body by Somedays Lovin',WHITE,Lingerie,100,"XS,S,M,L","XS,S,M,L",US TOPSHOP,Topshop US,"White body by Somedays Lovin. 85% Polyester, 15% Elastane. Machine wash.",Body by Somedays Lovin',NULL,NULL,26-04-20 19:42
**Padded Bra by Wonderbra,BLACK,Lingerie,44,"32D,34D,36D,32DD,34DD,32E,34E,36E",36D,US TOPSHOP,Topshop US,"Opt for an enhanced look in this full-support padded bra in black by iconic brand Wonderbra. 62% Polyamide, 22% Polyester, 16% Elastane. Machine wash.",**Padded Bra by Wonderbra,NULL,NULL,26-04-20 19:42
Soft Bra by BlueBella,Pink,Lingerie,50,"S,M,L,XL","S,M,L,XL",US TOPSHOP,Topshop US,"Pink soft bra by BlueBella. 90% Polyamide, 10% Elastane. Machine wash.",Soft Bra by BlueBella,NULL,NULL,26-04-20 19:42
Sporty Branded Thong,COBALT,Lingerie,10,"S,M,L","M,L",US TOPSHOP,Topshop US,"Opt for a simple but practical style when choosing underwear with this sporty thong in a low rise fit with Topshop branding detail. 85% Polyamide, 14% Elastane, 1% Polyester. Machine wash.",Sporty Branded Thong,NULL,NULL,26-04-20 19:42
Broderie Lace Balconette Bra,IVORY,Lingerie,40,"30A,30B,30C,30D,30E,32A,32B,32C,32D,32E,34A,34B,34C,34D,34E,36A,36B,36C,36D,36E,38A,38B,38C,38D,38E,30DD,32DD,34DD,36DD,38DD","32A,32B,32C,32D,34A,34B,34C,34D,36C",US TOPSHOP,Topshop US,"Lightly padded balcony bra with underwired cups for a smooth shape and added support 60% Polyamide,40% Cotton. Machine washable.",Broderie Lace Balconette Bra,NULL,NULL,26-04-20 19:42
Bohemian Plunge Bra,AQUA,Lingerie,52,"32A,32B,32C,32D,32DD,34A,34B,34C,34D,34DD,36A,36B,36C,36D","32A,32B,32C,32D,34A,34B,34C,34D,36B,36C",US TOPSHOP,Topshop US,Premium aqua plunge bra with applique detailing. 100% Polyamide. Machine wash.,Bohemian Plunge Bra,NULL,NULL,26-04-20 19:42
White Bra by Somedays Lovin',WHITE,Lingerie,75,"XS,S,M,L","XS,S,M,L",US TOPSHOP,Topshop US,"White bra by Somedays Lovin. 85% Polyester, 15% Elastane. Machine wash.",White Bra by Somedays Lovin',NULL,NULL,26-04-20 19:42
Eyelash Lace Plunge Bra,Blue,Lingerie,38,"32A,32B,32C,32D,32DD,34A,34B,34C,34D,34DD,36A,36B,36C,36D","32B,32C,32D,34A,34B,34C,34D,36C",US TOPSHOP,Topshop US,"Invest in a luxe piece for your lingerie drawer with this lightly padded bra in blue eyelash lace, with a plunging neckline and underwired cups for added support. 88% Polyamide, 12% Elastane. Machine wash.",Eyelash Lace Plunge Bra,NULL,NULL,26-04-20 19:42
Push Up Bra by Wonderbra,BLACK,Lingerie,46,"32A,34A,36A,32B,34B,36B,32C,34C,36C,38C,30D,32D,34D,36D",38C,US TOPSHOP,Topshop US,"Opt for an enhanced look in this full-support push up bra in black by iconic brand Wonderbra. 45% Polyester, 43% Polyamide, 12% Elastane. Machine wash.",Push Up Bra by Wonderbra,NULL,NULL,26-04-20 19:42
Lace Balcony Bra,CORAL,Lingerie,35,"32A,32B,32C,32D,32DD,34A,34B,34C,34D,34DD,36A,36B,36C,36D","32D,36B",US TOPSHOP,Topshop US,"Add a touch of lace to your lingerie collection with this pretty lace bra in coral with balcony cups for extra support. 89% Nylon, 11% Elastane. Machine wash.",Lace Balcony Bra,NULL,NULL,26-04-20 19:42
Camisole And Bikini Set by Bluebella,Pink,Lingerie,52,"S,M,L","M,L",US TOPSHOP,Topshop US,Pink camisole and frill mini knickers set by Bluebella. 100% Polyester. Machine wash.,Camisole And Bikini Set by Bluebella,NULL,NULL,26-04-20 19:42
Seamless Sporty Branded Bra,COBALT,Lingerie,15,"L,M,S",M,US TOPSHOP,Topshop US,"Opt for a simple but practical style when choosing underwear with this sporty bra in blue with ‘Topshop’ branding detail to the underband. 85% Nylon,14% Elastane,1% Polyester. Machine wash.",Seamless Sporty Branded Bra,NULL,NULL,26-04-20 19:42
Triangle Bra by Somedays Lovin',WHITE,Lingerie,60,"XS,S,M,L","XS,S,M",US TOPSHOP,Topshop US,This gorgeous triangle bra by Someday’s Lovin’ is a luxe addition to your underwear collection. We love the pretty embroidered detail to the cups. 100% Nylon. Machine wash.,Triangle Bra by Somedays Lovin',NULL,NULL,26-04-20 19:42
Thong by Bluebella,Pink,Lingerie,22,"4,6,8,10,12","4,6,8,10,12",US TOPSHOP,Topshop US,"Pink thong by Bluebella. 90% Polyamide,10% Elastane. Machine wash.",Thong by Bluebella,NULL,NULL,26-04-20 19:42
Lace Underwired Bra,CORAL,Lingerie,35,"32A,32B,32C,32D,32DD,34A,34B,34C,34D,34DD,36A,36B,36C,36D","32A,34A,34B,36A",US TOPSHOP,Topshop US,"It’s all about delicate detail with this floral lace bra. With underwired for support, it provides a barely there feel without pads. 89% Nylon, 11% Elastane. Machine wash.",Lace Underwired Bra,NULL,NULL,26-04-20 19:42
Lace Underwired Bra,GINGER,Lingerie,35,"32A,32B,32C,32D,32DD,34A,34B,34C,34D,34DD,36A,36B,36C,36D","32A,32B,32C,34A,34B,36A",US TOPSHOP,Topshop US,"Ginger underwired lace bra. 89% Nylon, 11% Elastane. Machine wash.",Lace Underwired Bra,NULL,NULL,26-04-20 19:42
Black Knickers by Somedays Lovin',BLACK,Lingerie,35,"XS,S,M,L","XS,S,M,L",US TOPSHOP,Topshop US,"Black knickers by Somedays Lovin'. 85% Polyester, 15% Elastane. Machine wash.",Black Knickers by Somedays Lovin',NULL,NULL,26-04-20 19:42
Criss Cross Mesh Underwire Bra,Nude,Lingerie,38,"32A,32B,32C,32D,32DD,34A,34B,34C,34D,34DD,36A,36B,36C,36D",34A,US TOPSHOP,Topshop US,"Update your under layers with this pretty lace underwire bra in a criss-cross design, with no pads for a barely-there feel. 78% Polyamide, 22% Elastane. Machine wash.",Criss Cross Mesh Underwire Bra,NULL,NULL,26-04-20 19:42
Seamless Sporty Thong,Pink,Lingerie,10,"S,M,L","S,M,L",US TOPSHOP,Topshop US,"This sporty thong comes in a cool fuschia with a low-rise fit. 85% Nylon,14% Elastane,1% Polyester. Machine wash.",Seamless Sporty Thong,NULL,NULL,26-04-20 19:42
Geo Floral Lace Underwire Bra,CHARCOAL,Lingerie,35,"32A,32B,32C,32D,34A,34B,34C,34D,36A,36B,36C,32DD","32A,32B,32C,34A,34B,36B",US TOPSHOP,Topshop US,"Non-padded bra with underwired cups for a barely-there feel with discreet support 85% Nylon,15% Elastane. Machine wash.",Geo Floral Lace Underwire Bra,NULL,NULL,26-04-20 19:42
Body by Somedays Lovin',BLACK,Lingerie,100,"XS,S,M,L","XS,S,M,L",US TOPSHOP,Topshop US,"Black body by Somedays Lovin. 85% Polyester, 15% Elastane. Machine wash.",Body by Somedays Lovin',NULL,NULL,26-04-20 19:42
Somedays Lovin' Bra,BLACK,Lingerie,75,"L,M,S,XL,XS","L,M,S,XS",US TOPSHOP,Topshop US,"Black 'break of dawn' bra by Somedays Lovin. 85% Polyester, 15% Elastane. Machine wash.",Somedays Lovin' Bra,NULL,NULL,26-04-20 19:42
Two Tone Lace Bralet,Nude,Lingerie,30,"2,4,6,8,10,12,14",8,US TOPSHOP,Topshop US,"Delicate lace is the focus of this pretty two-tone bralet in nude. 49% Polyamide, 36% Polyester, 15% Elastane. Machine wash.",Two Tone Lace Bralet,NULL,NULL,26-04-20 19:42
Basque by Bluebella,BLACK,Lingerie,90,"32B,32C,32D,34B,34C,34D,36A,36B,36C,36D","32B,32C,32D,34B,34C,34D,36B,36D",US TOPSHOP,Topshop US,"Black basque by Bluebella. 85% Polyester,15% Elastane. Machine wash.",Basque by Bluebella,NULL,NULL,26-04-20 19:42
Yasallie Mini Knickers by Yas,BLACK,Lingerie,22,"XS,S,M,L,XL","S,M,XL",US TOPSHOP,Topshop US,"Black mini knickers by Yas. 90% Polyamide, 10% Elastane. Machine wash.",Yasallie Mini Knickers by Yas,NULL,NULL,26-04-20 19:42
Laura Body by Bluebella,Pink,Lingerie,60,"32B,32C,32D,34B,34C,34D,36B,36C","32B,32C,32D,34B,34C",US TOPSHOP,Topshop US,"Rosa Body von Bluebella. 90 % Polyamid, 10 % Elastan. Maschinenwäsche.",Laura Body by Bluebella,NULL,NULL,26-04-20 19:42
Sporty Bra,PALE BLUE,Lingerie,15,"S,M,L","M,L",US TOPSHOP,Topshop US,"Pale blue sporty bra. 49% Polyamide, 39% Polyester, 12% Elastane. Machine wash.",Sporty Bra,NULL,NULL,26-04-20 19:42
Geo Lace Floral Bra,Fuschia,Lingerie,35,"32A,32B,32C,32D,32DD,34A,34B,34C,34D,36A,36B,36C","32A,32B,32C,32D,34A,34B,34C,36B,36C",US TOPSHOP,Topshop US,"Add a pop of colour to your lingerie collection in this vibrant fuschia non-padded bra with underwired cups for a barely-there feel with discreet support. 85% Nylon, 15% Elastane. Machine wash.",Geo Lace Floral Bra,NULL,NULL,26-04-20 19:42
Bra by Bluebella,BLACK,Lingerie,58,"XS,S,M,L","XS,S,M",US TOPSHOP,Topshop US,"Black bra by Bluebella. 85% Polyester, 15% Elastane. Machine wash.",Bra by Bluebella,NULL,NULL,26-04-20 19:42
Soft Triangle Bra by Bluebella,BLACK,Lingerie,50,"S,M,L,XL","S,M,L,XL",US TOPSHOP,Topshop US,"Black soft triangle bra by Bluebella with gold metal detail. 90% Polyamide, 10% Elastane. Machine wash.",Soft Triangle Bra by Bluebella,NULL,NULL,26-04-20 19:42
Satin and Lace Plunge Bra,ICE BLUE,Lingerie,38,"32A,32B,32C,32D,32DD,34A,34B,34C,34D,34DD,36A,36B,36C,36D","34A,34B,34C,36A,36C",US TOPSHOP,Topshop US,"Opt for a pretty touch to your lingerie basics in this lightly padded bra with a plunging neckline and underwired cups for added support. 89% Polyamide, 11% Elastane. Machine wash.",Satin and Lace Plunge Bra,NULL,NULL,26-04-20 19:42
Yasallie Bra by Yas,ROSE,Lingerie,28,"XS,S,M,L,XL","L,XL",US TOPSHOP,Topshop US,"Roséfarbener BH von Yas. 90 % Polyamid, 10 % Elastan. Maschinenwäsche.",Yasallie Bra by Yas,NULL,NULL,26-04-20 19:42
Mesh Bralet by Somedays Lovin',BLACK,Lingerie,58,"XS,S,M,L",M,US TOPSHOP,Topshop US,"Burnout mesh bralet with floral detail. Matches with knickers. 92% Polyester, 8% Elastane. Machine wash.",Mesh Bralet by Somedays Lovin',NULL,NULL,26-04-20 19:42
Floral Balcony Bra,Pale Pink,Lingerie,35,"32A,32B,32C,32D,32DD,34A,34B,34C,34D,34DD,36A,36B,36C,36D","34C,36B,36C",US TOPSHOP,Topshop US,"Delicate floral lace is the focus of this balcony bra. With underwired cups for a smooth shape and added support. 90% Polyamide, 10% Elastane. Machine wash.",Floral Balcony Bra,NULL,NULL,26-04-20 19:42
Padded Bralet,KHAKI,Lingerie,45,"32A,32B,32C,32D,34A,34B,34C,34D,36A,36B,36C,36D,32DD,34DD","32C,32D,34A,34D,36A",US TOPSHOP,Topshop US,"Khaki satin bralet with underwire and padding 89% Polyamide,11% Elastane. Machine washable.",Padded Bralet,NULL,NULL,26-04-20 19:42
Bra by Somedays Lovin',BLACK,Lingerie,60,"L,M,S,XS","M,S,XS",US TOPSHOP,Topshop US,Black bra by Somedays Lovin'. 100% Nylon. Machine wash.,Bra by Somedays Lovin',NULL,NULL,26-04-20 19:42
Sporty Thong,Bright Pink,Lingerie,10,"S,M,L","S,M,L",US TOPSHOP,Topshop US,"Bright pink sporty thong. 85% Polyamide, 14% Elastane, 1% Polyester. Machine wash.",Sporty Thong,NULL,NULL,26-04-20 19:42
Blue Bra by Somedays Lovin',Blue,Lingerie,75,"XS,S,M,L","XS,S,M,L",US TOPSHOP,Topshop US,Blue bra by Somedays Lovin'. 100% Rayon. Machine wash.,Blue Bra by Somedays Lovin',NULL,NULL,26-04-20 19:42
Suspenders by BlueBella,Pink,Lingerie,30,"4,6,8,10","4,6,8,10",US TOPSHOP,Topshop US,"Pink suspenders by BlueBella. 89% Polyamide, 11% Elastane. Machine wash.",Suspenders by BlueBella,NULL,NULL,26-04-20 19:42
Embroidered Triangle Bra,MULTI,Lingerie,40,"2,4,6,8,10,12,14","2,4,6,8,10,12",US TOPSHOP,Topshop US,"Nude mesh triangle bra with floral embroidery detail and cross-over detail back. 89% Polyamide, 11% Elastane. Machine wash.",Embroidered Triangle Bra,NULL,NULL,26-04-20 19:42
Knickers by Somedays Lovin',WHITE,Lingerie,35,"XS,S,M,L","XS,S,M,L",US TOPSHOP,Topshop US,"White knickers by Somedays Lovin'. 85% Polyester, 15% Elastane. Machine wash.",Knickers by Somedays Lovin',NULL,NULL,26-04-20 19:42
Underwired Lace Bra,IVORY,Lingerie,35,"32A,32B,32C,32D,32DD,34A,34B,34C,34D,36A,36B,36C","32A,32B,32C,32D,34A,34B,34C,36B",US TOPSHOP,Topshop US,"It’s all about delicate detail with this floral lace bra. With underwired for support, it provides a barley there feel without pads. 89% Nylon, 15% Elastane. Machine wash.",Underwired Lace Bra,NULL,NULL,26-04-20 19:42
Broderie Lace Underwired Bra,natural,Lingerie,38,"32A,32B,32C,32D,32DD,34A,34B,34C,34D,34DD,36A,36B,36C,36D","32A,32B,32C,32D,34A,34B,34C,34D,36A,36C",US TOPSHOP,Topshop US,"Non-padded bra with underwired cups for a barely-there feel with discreet support. 90% Polyamide,10% Elastane. Machine wash.",Broderie Lace Underwired Bra,NULL,NULL,26-04-20 19:42
Laura Suspenders by Bluebella,BLACK,Lingerie,30,"4,6,8,10","4,6,8,10",US TOPSHOP,Topshop US,"Black suspenders by Bluebella. 89% Polyamide, 11% Elastane. Machine wash.",Laura Suspenders by Bluebella,NULL,NULL,26-04-20 19:42
**Rose Balcony Bra by TOPSHOP BRIDE,IVORY,Lingerie,38,"32A,32B,32C,32D,32DD,34A,34B,34C,34D,34DD,36A,36B,36C,36D","32A,32B,32D",US TOPSHOP,Topshop US,"Perfect your bridal intimates in this pretty ivory balcony bra with luxy lace trim detail. 96% Polyester, 4% Elastane. Machine wash.",**Rose Balcony Bra by TOPSHOP BRIDE,NULL,NULL,26-04-20 19:42
Broderie Lace Balcony Bra,IVORY,Lingerie,35,"32A,32B,32C,32D,34A,34B,34C,34D,36A,36B,36C,36D,32DD,34DD","32A,32B,32C,32D,34A,34B,34C,34D,36A,36B",US TOPSHOP,Topshop US,"Lightly padded balcony bra with underwired cups for a smooth shape and added support. 90% Polyamide,10% Elastane. Machine wash.",Broderie Lace Balcony Bra,NULL,NULL,26-04-20 19:42
Applique Jersey Triangle Bra,BLACK,Lingerie,35,"2,4,6,8,10,12,14","2,4,6,8,10,12",US TOPSHOP,Topshop US,"Non-padded triangle bra with non-wired cups for a barely there, natural shape. 95% Viscose, 5% Elastane. Machine wash.",Applique Jersey Triangle Bra,NULL,NULL,26-04-20 19:42
Lace Balcony Bra,IVORY,Lingerie,35,"32A,32B,32C,32D,32DD,34A,34B,34C,34D,36A,36B,36C","32B,32C,32D,34A,34C,34D,36C",US TOPSHOP,Topshop US,"Add a touch of lace to your lingerie collection with this pretty ivory lace bra with balcony cups for extra support. 89% Nylon,11% Elastane. Machine wash.",Lace Balcony Bra,NULL,NULL,26-04-20 19:42
Laura Mini Knickers by Bluebella,BLACK,Lingerie,26,"4,6,8,10,12","4,6,8,10,12",US TOPSHOP,Topshop US,"Black mesh and satin mini knickers by Bluebella with gold metal detail. 90% Polyamide, 10% Elastane. Machine wash.",Laura Mini Knickers by Bluebella,NULL,NULL,26-04-20 19:42
Laura Body by Bluebella,BLACK,Lingerie,60,"32B,32C,32D,34B,34C,34D,36B,36C","32B,32C,32D,34B,34C",US TOPSHOP,Topshop US,"Lend your base layers a luxe feel with this black plunge body by Bluebella. We love the sultry effect of the mesh panels to the sides. 90% Polyamide, 10% Elastane. Machine wash.",Laura Body by Bluebella,NULL,NULL,26-04-20 19:42
Sporty Thong,Bright Coral,Lingerie,10,"S,M,L","M,L",US TOPSHOP,Topshop US,"Bright coral sporty thong. 85% Polyamide,14% Elastane,1% Polyester. Machine wash.",Sporty Thong,NULL,NULL,26-04-20 19:42
