product_name,color,product_category,mrp,total_sizes,available_size,brand_name,retailer,description,pdp_url,rating,review_count,scrapping_datetime
Marble Print Mini Knickers,MULTI,Lingerie,20,"2,4,6,8,10,12","2,4,6,8,10,12",US TOPSHOP,Topshop US,"With an innovative marble print and sporty waistband, these distinctive mini knickers will revamp your lingerie collection. 86% Polyester, 14% Elastane. Machine wash.",Marble Print Mini Knickers,NULL,NULL,26-04-20 19:42
Geometric Lace Racerback Mini Knickers,CHARTREUSE,Lingerie,22,"2,4,6,8,10,12","2,4,6,8,10,12",US TOPSHOP,Topshop US,"Chartreuse mini knickers in geometric lace with chartreuse binding detailing. 89% Polyamide, 11% Elastane. Machine wash.",Geometric Lace Racerback Mini Knickers,NULL,NULL,26-04-20 19:42
Floral Lace Triangle Bra,BURNT ORANGE,Lingerie,35,"2,4,6,8,10,12","2,6,8,10,12",US TOPSHOP,Topshop US,"In beautiful burnt orange floral lace, this non-padded triangle bra comes with wireless cups for a natural and comfortable shape. 90% Polyamide, 10% Elastane. Machine wash.",Floral Lace Triangle Bra,NULL,NULL,26-04-20 19:42
Gem Embellished Triangle Bra,Bright Pink,Lingerie,45,"2,4,6,8,10,12","2,4,6,8,10,12",US TOPSHOP,Topshop US,"This bright pink gem embellished triangle bra will add a touch of sparkle to your lingerie draw. 90% Polyamide, 10% Elastane. Machine wash.",Gem Embellished Triangle Bra,NULL,NULL,26-04-20 19:42
Two Tone Lace Bralet,CORAL,Lingerie,30,"2,4,6,8,10,12","2,4,6,8,10",US TOPSHOP,Topshop US,"Coral two tone lace bralet with sporty underband detail. 49% Polyamide, 36% Polyester, 15% Elastane. Machine wash.",Two Tone Lace Bralet,NULL,NULL,26-04-20 19:42
Ombre Triangle Bra,INDIGO,Lingerie,30,"2,4,6,8,10,12","2,4,6,8,10,12",US TOPSHOP,Topshop US,"Indigo ombre soft triangle bra. 94% Polyamide, 6% Elastane. Machine wash.",Ombre Triangle Bra,NULL,NULL,26-04-20 19:42
Padded Lace Bralet,AQUA,Lingerie,30,"2,4,6,8,10,12","2,4,6,8,10,12",US TOPSHOP,Topshop US,"Aqua lace bralet with padded cups for extra support. 89% Nylon,11% Elastane. Machine wash.",Padded Lace Bralet,NULL,NULL,26-04-20 19:42
Pretty Lace Triangle Bra,IVORY,Lingerie,26,"2,4,6,8,10,12",12,US TOPSHOP,Topshop US,"Ivory triangle bra in lace. 88% Polyamide, 12% Elastane. Machine wash.",Pretty Lace Triangle Bra,NULL,NULL,26-04-20 19:42
Two Tone Lace Bralet,CHARTREUSE,Lingerie,30,"2,4,6,8,10,12","2,4,6,8,10",US TOPSHOP,Topshop US,"Chartreuse two tone lace bralet with sporty underband detail. 49% Polyamide, 36% Polyester, 15% Elastane. Machine wash.",Two Tone Lace Bralet,NULL,NULL,26-04-20 19:42
Padded Lace Triangle Bra,BURNT ORANGE,Lingerie,30,"2,4,6,8,10,12","2,4,6,8,10,12",US TOPSHOP,Topshop US,"Burnt orange lace triangle bra with pad and racerback detail. 89% Nylon,11% Elastane. Machine wash.",Padded Lace Triangle Bra,NULL,NULL,26-04-20 19:42
Lacey Strap Triangle Bra,Bubblegum Pink,Lingerie,35,"2,4,6,8,10,12","8,12",US TOPSHOP,Topshop US,"Revamp your underwear collection with this unique non-padded, non-wired cup triangle bra with cool strappy detailing. 89% Polyamide,11% Elastane. Machine wash.",Lacey Strap Triangle Bra,NULL,NULL,26-04-20 19:42
Strawberry Applique Mini Knickers,RED,Lingerie,22,"2,4,6,8,10,12","2,6,10,12",US TOPSHOP,Topshop US,"Update your lingerie collection with these mini knickers in red, featuring cute strawberry applique and velvet detail. 89% Polyamide, 11% Elastane. Machine wash.",Strawberry Applique Mini Knickers,NULL,NULL,26-04-20 19:42
**Lace Triangle Bra by TOPSHOP BRIDE,IVORY,Lingerie,38,"2,4,6,8,10,12","4,12",US TOPSHOP,Topshop US,"In a beautiful ivory lace, this beautiful triangle bra gives a delicate touch to your under layers. Perfect for wearing under your wedding dress, it features no pads and non-wired cups for a barely there natural shape. 100% Polyester. Machine wash.",**Lace Triangle Bra by TOPSHOP BRIDE,NULL,NULL,26-04-20 19:42
Full Lace Knickers,COBALT,Lingerie,8,"2,4,6,8,10,12","2,4,8,12",US TOPSHOP,Topshop US,"Soft and semi-sheer, these full-lace panties sit comfortably on the waist for a barely-there unnoticeable feel. Available in other colours. 83% Nylon, 17% Elastane. Machine wash.",Full Lace Knickers,NULL,NULL,26-04-20 19:42
Pretty Lace Triangle Bra,TAUPE,Lingerie,38,"2,4,6,8,10,12","8,10",US TOPSHOP,Topshop US,"Non-padded triangle bra with non-wired cups for a barely there, natural shape. 66% Polyamide, 22% Viscose, 12% Elastane. Machine wash.",Pretty Lace Triangle Bra,NULL,NULL,26-04-20 19:42
Pretty Lace Triangle Bra,YELLOW,Lingerie,26,"2,4,6,8,10,12",8,US TOPSHOP,Topshop US,"Add a dose of colour to your underwear drawer with our yellow triangle bra. You'll bound to feel extra pretty with the delicate lace and soft cup design. 88% Polyamide, 12% Elastane. Machine wash.",Pretty Lace Triangle Bra,NULL,NULL,26-04-20 19:42
Eyelash Lace Triangle Bra,RED,Lingerie,38,"2,4,6,8,10,12","2,4,6,8,10",US TOPSHOP,Topshop US,Revamp your underwear collection with this unique non-padded triangle bra in eyelash lace with strap detailing. Works as a set with strappy lace thong. 100% Polyamide. Machine wash.,Eyelash Lace Triangle Bra,NULL,NULL,26-04-20 19:42
Strappy Lace Thong,GREY,Lingerie,20,"2,4,6,8,10,12","6,10",US TOPSHOP,Topshop US,Revamp your underwear collection with this unique low rise thong featuring eyelash lace and strappy detailing. Works as a set with Strappy Lace Triangle Bra. 100% Polyamide. Machine wash.,Strappy Lace Thong,NULL,NULL,26-04-20 19:42
Eyelash Lace Strappy Triangle Bra,KHAKI,Lingerie,38,"2,4,6,8,10,12","4,6,8,10,12",US TOPSHOP,Topshop US,"Get glamorous with your underlayer in this eyelash lace triangle bra. Its non-padded, non-wired cups create a barely there feel and natural shape. 100% Polyamide. Machine wash.",Eyelash Lace Strappy Triangle Bra,NULL,NULL,26-04-20 19:42
PRETTY LACE THONG,TAUPE,Lingerie,20,"2,4,6,8,10,12","8,10",US TOPSHOP,Topshop US,"Keep fitted silhouettes seam-free with this pretty taupe lace thong underneath. A semi-sheer style with a mid rise fit and strap detail. 66% Polyamide, 22% Viscose, 12% Elastane. Machine wash.",PRETTY LACE THONG,NULL,NULL,26-04-20 19:42
Colourblock Mini Knickers,PLUM,Lingerie,15,"2,4,6,8,10,12","2,4,6,8,10,12",US TOPSHOP,Topshop US,"Plum and navy colourblock sporty mini knickers. 85% Polyamide, 15% Elastane. Machine wash.",Colourblock Mini Knickers,NULL,NULL,26-04-20 19:42
**Triangle Bra by TOPSHOP BRIDE,IVORY,Lingerie,35,"2,4,6,8,10,12","2,4,6,8,10,12",US TOPSHOP,Topshop US,"Perfect your bridal under layer in this pretty ivory triangle bra with luxy lace trim detail. 96% Polyester, 4% Elastane. Machine wash.",**Triangle Bra by TOPSHOP BRIDE,NULL,NULL,26-04-20 19:42
**Mini Knickers by TOPSHOP BRIDE,IVORY,Lingerie,20,"2,4,6,8,10,12","2,6,8,10,12",US TOPSHOP,Topshop US,"Elevate your bridal intimates with these pretty ivory knickers in a satin-feel. 96% Polyester, 4% Elastane. Machine wash.",**Mini Knickers by TOPSHOP BRIDE,NULL,NULL,26-04-20 19:42
Patterned Elastic Triangle Bra,Blush,Lingerie,38,"2,4,6,8,10,12","6,8,10",US TOPSHOP,Topshop US,"Get pretty with your intimates in this non-padded triangle bra in a patterned design with non-wired cups for a barely-there, natural shape. 86% Polyester, 14% Elastane. Machine wash.",Patterned Elastic Triangle Bra,NULL,NULL,26-04-20 19:42
Bohemian Mini Knickers,AQUA,Lingerie,22,"2,4,6,8,10,12","4,6,12",US TOPSHOP,Topshop US,"|Premium aqua mini knickers with applique and strap detailing. 84% Polyamide, 16% Elastane. Machine wash.|",Bohemian Mini Knickers,NULL,NULL,26-04-20 19:42
Brazilian Knickers,Deep Berry,Lingerie,20,"2,4,6,8,10,12","2,8,10,12",US TOPSHOP,Topshop US,"Go luxe with your intimates in these brazilian knicker in a sultry deep berry hue. 88% Polyamide, 12% Elastane. Machine wash.",Brazilian Knickers,NULL,NULL,26-04-20 19:42
**Mini Knickers by TOPSHOP BRIDE,IVORY,Lingerie,22,"2,4,6,8,10,12","2,4,6,8,10,12",US TOPSHOP,Topshop US,"In a beautiful ivory lace, these low-rise mini knickers come with good coverage and are perfect for wearing under your wedding dress. 100% Polyester. Machine wash.",**Mini Knickers by TOPSHOP BRIDE,NULL,NULL,26-04-20 19:42
Spot Chiffon Mini Knickers,Pale Pink,Lingerie,20,"2,4,6,8,10,12","6,10",US TOPSHOP,Topshop US,Lingerie set featuring non-padded lingerie bra with non-wired cups with front fastening and mini knickers with low coverage. 100% Polyester. Machine wash. 100% Polyester. Machine wash.,Spot Chiffon Mini Knickers,NULL,NULL,26-04-20 19:42
Jersey and Mesh Mini Knickers,CORAL,Lingerie,15,"2,4,6,8,10,12","2,4,6,10",US TOPSHOP,Topshop US,"Mini with mesh back coverage. 89% Polyamide, 11% Elastane. Machine wash.",Jersey and Mesh Mini Knickers,NULL,NULL,26-04-20 19:42
Patterned Elasticated Mini Knickers,Blush,Lingerie,20,"2,4,6,8,10,12","2,10",US TOPSHOP,Topshop US,"Get pretty with your intimates in these low-rise elasticated mini knickers in a patterned finish with good coverage. 86% Polyester, 14% Elastane. Machine wash.",Patterned Elasticated Mini Knickers,NULL,NULL,26-04-20 19:42
Eyelash Lace Thong,RED,Lingerie,20,"2,4,6,8,10,12",10,US TOPSHOP,Topshop US,Revamp your underwear collection with this unique low rise thong featuring eyelash lace and strappy detailing. 100% Polyamide. Machine wash.,Eyelash Lace Thong,NULL,NULL,26-04-20 19:42
Pretty Lace Triangle Bra,KHAKI,Lingerie,26,"2,4,6,8,10,12","6,8",US TOPSHOP,Topshop US,"Add a level of sophistication to your lingerie with our khaki lace triangle bra. 88% Polyamide, 12% Elastane. Machine wash.",Pretty Lace Triangle Bra,NULL,NULL,26-04-20 19:42
Strawberry Applique Triangle Bra,RED,Lingerie,40,"2,4,6,8,10,12","4,6,10,12",US TOPSHOP,Topshop US,"Seriously upspec your lingerie collection with this stunning triangle bra with non-wired cups. It features cute strawberry applique as well as cross-straps to the back and strappy detail to the front. 89% Polyamide, 11% Elastane. Machine wash.",Strawberry Applique Triangle Bra,NULL,NULL,26-04-20 19:42
Floral Geo Lace Triangle Bra,Pink,Lingerie,30,"2,4,6,8,10,12","2,4,6,8,12",US TOPSHOP,Topshop US,"Non-padded triangle bra with non-wired cups for a barely there, natural shape. 85% Nylon, 15% Elastane. Machine wash.",Floral Geo Lace Triangle Bra,NULL,NULL,26-04-20 19:42
Floral Lace Thong,Pale Pink,Lingerie,20,"2,4,6,8,10,12","2,8,10,12",US TOPSHOP,Topshop US,"Add luxe lace to your underwear collection with these low rise thongs in pale pink. 90% Polyamide, 10% Elastane. Machine wash.",Floral Lace Thong,NULL,NULL,26-04-20 19:42
Lace Triangle Bra,ROSE,Lingerie,30,"2,4,6,8,10,12",8,US TOPSHOP,Topshop US,"Delicate floral lace is the focus of this triangle bra. With a matching underband, racer-back detail and front fastening. 85% Nylon, 15% Elastane. Machine wash.",Lace Triangle Bra,NULL,NULL,26-04-20 19:42
Lacey Body,BLACK,Lingerie,65,"2,4,6,8,10,12","4,6,10",US TOPSHOP,Topshop US,"Think sultry base layers to elevate your look underneath. This black lace body comes in a sheer, strappy design, with padded cups for added support. 90% Nylon,10% Elastane. Machine wash.",Lacey Body,NULL,NULL,26-04-20 19:42
Front Fastening Dot Triangle Bra,Pale Pink,Lingerie,38,"2,4,6,8,10,12","6,8,10",US TOPSHOP,Topshop US,"Non-padded triangle bra with non-wired cups for a barely there, natural shape with front fastening. 100% Polyester. Machine wash.",Front Fastening Dot Triangle Bra,NULL,NULL,26-04-20 19:42
Broderie Lace Mini Knickers,IVORY,Lingerie,15,"2,4,6,8,10,12","2,4,6,8,10,12",US TOPSHOP,Topshop US,"Mini knickers with good coverage. 90% Polyamide, 10% Elastane. Machine wash.",Broderie Lace Mini Knickers,NULL,NULL,26-04-20 19:42
Floral Applique Jersey Thong,BLACK,Lingerie,15,"2,4,6,8,10,12","6,8,10,12",US TOPSHOP,Topshop US,"|Black jersey thong with pretty floral applique detailing. 95% Viscose, 5% Elastane. Machine wash.|",Floral Applique Jersey Thong,NULL,NULL,26-04-20 19:42
Jersey Applique Triangle Bra,PLUM,Lingerie,35,"2,4,6,8,10,12","2,4,6,8,10,12",US TOPSHOP,Topshop US,"With cross-back straps and floral applique detailing, this plum jersey triangle bra pairs form with function for beautiful and comfortable support. 95% Viscose, 5% Elastane. Machine wash.",Jersey Applique Triangle Bra,NULL,NULL,26-04-20 19:42
Jersey Applique Thong,PLUM,Lingerie,15,"2,4,6,8,10,12","2,4,6,8,10,12",US TOPSHOP,Topshop US,"Plum jersey thong with floral applique detail. 95% Viscose,5% Elastane. Machine wash.",Jersey Applique Thong,NULL,NULL,26-04-20 19:42
Criss Cross Lace Mini Knickers,Nude,Lingerie,20,"2,4,6,8,10,12","4,6,8,10,12",US TOPSHOP,Topshop US,"Low rise mini knickers with good coverage. 78% Polyamide, 22% Elastane. Machine wash.",Criss Cross Lace Mini Knickers,NULL,NULL,26-04-20 19:42
Colourblock Triangle Bra,PLUM,Lingerie,35,"2,4,6,8,10,12","2,4,6,8,10,12",US TOPSHOP,Topshop US,"Plum and navy colourblock sporty triangle bra. 85% Polyamide, 15% Elastane. Machine wash.",Colourblock Triangle Bra,NULL,NULL,26-04-20 19:42
Jersey and Mesh Bralet,CORAL,Lingerie,26,"2,4,6,8,10,12","2,4,6,8,10,12",US TOPSHOP,Topshop US,"We love the sporty style of this coral bralet with non-padded cups to support a natural shape. 89% Polyamide, 11% Elastane. Machine wash.",Jersey and Mesh Bralet,NULL,NULL,26-04-20 19:42
Satin Brazilian Knickers,KHAKI,Lingerie,20,"2,4,6,8,10,12",12,US TOPSHOP,Topshop US,"Khaki satin brazillian pant 89% Polyamide,11% Elastane. Machine washable.",Satin Brazilian Knickers,NULL,NULL,26-04-20 19:42
Pretty Lace Padded Bralet,CORAL,Lingerie,30,"2,4,6,8,10,12",6,US TOPSHOP,Topshop US,"Delicate floral lace is the focus of this pretty bralet. With padded cups for a supported, natural shape. 89% Nylon,11% Elastane. Machine wash.",Pretty Lace Padded Bralet,NULL,NULL,26-04-20 19:42
Romantic Lace Bralet,PALE BLUE,Lingerie,30,"2,4,6,8,10,12",6,US TOPSHOP,Topshop US,"Add pretty lace to your lingerie collection with this bralet in pale blue with non-padded cups for a supported natural shape. 79% Polyamide, 21% Elastane. Machine wash.",Romantic Lace Bralet,NULL,NULL,26-04-20 19:42
Bohemian Triangle Bra,AQUA,Lingerie,50,"2,4,6,8,10,12",12,US TOPSHOP,Topshop US,Premium aqua triangle bra with applique detailing. 100% Polyamide. Machine wash.,Bohemian Triangle Bra,NULL,NULL,26-04-20 19:42
Padded Lace Triangle Bra,NAVY BLUE,Lingerie,30,"2,4,6,8,10,12","2,4,6,8,10,12",US TOPSHOP,Topshop US,"In a deep navy shade, this elegant padded lace triangle bra boasts a contrast waistband, racerback and adjustable straps. 89% Nylon, 11% Elastane. Machine wash.",Padded Lace Triangle Bra,NULL,NULL,26-04-20 19:42
Pretty Lace Brazillian Knickers,Bright Pink,Lingerie,8,"2,4,6,8,10,12",12,US TOPSHOP,Topshop US,"Floral lace goes semi-sheer and sultry with these Brazilian knickers. Comes in a low-rise fit with an elastic free leg-line for a seamless fit. 79% Polyamide, 21% Elastane. Machine wash.",Pretty Lace Brazillian Knickers,NULL,NULL,26-04-20 19:42
Two Tone Lace Bralet,PALE BLUE,Lingerie,30,"2,4,6,8,10,12","2,6,8",US TOPSHOP,Topshop US,"Zweifarbig pastellblaues, ungepolstertes Spitzenbustier 49 % Polyamid, 36 % Polyester, 15 % Elastan. Maschinenwäsche.",Two Tone Lace Bralet,NULL,NULL,26-04-20 19:42
Romantic Lace Bralet,Bright Pink,Lingerie,30,"2,4,6,8,10,12","2,6,8",US TOPSHOP,Topshop US,"Add pretty lace to your lingerie collection with this bralet in bright pink with non-padded cups for a supported, natural shape. 79% Polyamide, 21% Elastane. Machine wash.",Romantic Lace Bralet,NULL,NULL,26-04-20 19:42
Colourblock Mini Knickers,Nude,Lingerie,15,"2,4,6,8,10,12","2,4,6,8,10,12",US TOPSHOP,Topshop US,"Nude and pale blue colourblock mini knickers. 85% Polyamide, 15% Elastane. Machine wash.",Colourblock Mini Knickers,NULL,NULL,26-04-20 19:42
MATERNITY Criss Cross Knickers,BLACK,Lingerie,20,"4,6,8,10,12","4,6,8,10,12",US TOPSHOP,Topshop US,"These feminine black knickers for maternity features a criss cross detailing that adds a stylish hint to your under layer. Pair with the matching criss cross bra for a polished co-ord. 78% Polyamide, 22% Elastane. Machine wash.",MATERNITY Criss Cross Knickers,NULL,NULL,26-04-20 19:42
Mesh French Knickers,RASPBERRY,Lingerie,10,"2,4,6,8,10,12,14","4,6,8,10,12",US TOPSHOP,Topshop US,"Indulge your playful side with these sheer mesh french knickers, complete with a lace trim. A flattering cut at the back makes these the perfect pants for any occasion. 88% Polyester, 12% Elastane. Machine wash.",Mesh French Knickers,NULL,NULL,26-04-20 19:42
Embroidered Bralet,BLACK,Lingerie,45,"32A,32B,32C,32D,32DD,34A,34B,34C,34D,34DD,36A,36B,36C,36D","32A,32D,32DD,34A,34B,34C,34D,34DD,36A,36B,36C,36D",US TOPSHOP,Topshop US,"Fall in love with this elegant black bralet complete with gorgeous floral lace embroidery. Styled with strap detail at the front, underwired cups and adjustable straps, it's finished with multiple hook and eye fastenings. 84% Polyamide, 16% Elastane. Machine wash.",Embroidered Bralet,NULL,NULL,26-04-20 19:42
Triangle Bra,TEAL,Lingerie,30,"2,4,6,8,10,12,14","2,4,6,8,10,14",US TOPSHOP,Topshop US,"Teal triangle bra with geometric lace. 87% Nylon, 13% Elastane. Machine wash.",Triangle Bra,NULL,NULL,26-04-20 19:42
Embroidered Mini Knickers,BLACK,Lingerie,20,"2,4,6,8,10,12,14","2,6,10",US TOPSHOP,Topshop US,"Opt for a pretty touch when choosing your lingerie with these black mesh mini knickers complete with floral embroidery. 84% Polyamide,16% Elastane. Machine wash.",Embroidered Mini Knickers,NULL,NULL,26-04-20 19:42
Colour Block Cross Back Bra by Ivy Park,MULTI,Lingerie,45,"XXS,XS,S,M,L,XL","XXS,XS,S,M,XL",US TOPSHOP,Topshop US,"In a striking colour-block design with a tonal logo waistband, this Ivy Park sports bra is so good your can wear it as outerwear. This mid-impact style is made from breathable, quick-drying fabric that wicks sweat away from the body - you'll feel fresh and comfortable throughout your workout. It's complete with a power mesh lining, crossover straps and open back detail. 79% Polyester, 21% Elastane. Machine wash.",Colour Block Cross Back Bra by Ivy Park,NULL,NULL,26-04-20 19:42
Lace Balcony Bra,AQUA,Lingerie,35,"32A,32B,32C,32D,32DD,34A,34B,34C,34D,36A,36B,36C","32B,32C,32D,34A,34B,34C,34D,36B,36C",US TOPSHOP,Topshop US,"Aqua lace balcony bra. 89% Nylon, 11% Elastane. Machine wash.",Lace Balcony Bra,NULL,NULL,26-04-20 19:42
Bralet by Tommy Hilfiger,NAVY BLUE,Lingerie,52,"XS,S,M,L,XL","XS,S,M,L,XL",US TOPSHOP,Topshop US,"Navyblaues Bustier von Tommy Hilfiger. 94 % Baumwolle, 6 % Elastan. Maschinenwäsche.",Bralet by Tommy Hilfiger,NULL,NULL,26-04-20 19:42
Lace Plunge Bra,BLACK,Lingerie,35,"32A,32B,32C,32D,32DD,34A,34B,34C,34D,34DD,36A,36B,36C,36D","32A,32B,32C,32D,32DD,34A,34B,34C,34D,34DD,36B,36C",US TOPSHOP,Topshop US,"This elegant black plunge bra has been prettified with a gorgeous lace overlay. It features underwired cups, adjustable straps and hook and eye fastenings at the back. 89% Polyamide, 11% Elastane. Machine wash.",Lace Plunge Bra,NULL,NULL,26-04-20 19:42
Embroidered Mesh Triangle Bra,BLACK,Lingerie,40,"2,4,6,8,10,12,14","2,4,6,8,10,12,14",US TOPSHOP,Topshop US,"In a black mesh design, this flattering triangle bra come in a pretty embroidered floral design. 84% Polyamide, 16% Elastane. Machine wash.",Embroidered Mesh Triangle Bra,NULL,NULL,26-04-20 19:42
'Topshop' Logo Seamless Thong,LILAC,Lingerie,10,"S,M,L","S,M,L",US TOPSHOP,Topshop US,"Keep things simple and stylish in this comfortable lilac seamless thong with 'Topshop' logo. Co-ord available. 85% Polyamide, 13% Polyester, 2% Elastane. Machine wash.",'Topshop' Logo Seamless Thong,NULL,NULL,26-04-20 19:42
Popper Rib Thong Bodysuit,NAVY BLUE,Lingerie,26,"2,4,6,8,10,12,14","2,4,6,8,10,12",US TOPSHOP,Topshop US,"In a deep navy shade, this popper ribbed thong bodysuit is a daring look. 94% Viscose, 6% Elastane. Machine wash.",Popper Rib Thong Bodysuit,NULL,NULL,26-04-20 19:42
Fishnet Bodysuit,BLACK,Lingerie,38,"2,4,6,8,10,12,14","4,6,8,10,12,14",US TOPSHOP,Topshop US,"Wear your underwear as outerwear with our edgy fishnet bodysuit. Great for teaming with high-waisted skirts and shorts, this sheer black sleeveless style features a scoop neckline, a solid insert of fabric on the chest and a subtle cutaway detail. 89% Polyester, 11% Elastane. Machine wash.",Fishnet Bodysuit,NULL,NULL,26-04-20 19:42
MATERNITY Lace And Mesh Mini Panties,Pale Pink,Lingerie,15,"4,6,8,10,12","4,6,8,10,12",US TOPSHOP,Topshop US,"These pretty maternity panties come in a soft lace mesh finish, detailed with a sweet bow trim. 90% Polyamide, 10% Elastane. Machine wash.",MATERNITY Lace And Mesh Mini Panties,NULL,NULL,26-04-20 19:42
Longline Padded Bralet,BLACK,Lingerie,30,"2,4,6,8,10,12,14","2,4,6,8,10,14",US TOPSHOP,Topshop US,"Keep your cropped styles looking luxe with this delicate lace longline padded bralet in black. We’re styling with a frill denim skirt for a look that can be transitioned from day to night. 86% Nylon, 14% Elastane. Machine wash.",Longline Padded Bralet,NULL,NULL,26-04-20 19:42
Sporty Lace Bralet,BLACK,Lingerie,30,"2,4,6,8,10,12,14","2,4,6,8,10,12,14",US TOPSHOP,Topshop US,"Pretty meets sporty with this black lace non-padded bralet in black, with underwired detail for added support. 79% Polyamide, 21% Elastane. Machine wash.",Sporty Lace Bralet,NULL,NULL,26-04-20 19:42
Two Tone Lace Brazilian Knickers,Nude,Lingerie,10,"2,4,6,8,10,12,14","2,4,6,8,10,12,14",US TOPSHOP,Topshop US,"Nude two tone lace Brazilian knickers. 49% Polyamide, 36% Polyester, 15% Elastane. Machine wash.",Two Tone Lace Brazilian Knickers,NULL,NULL,26-04-20 19:42
Triangle Bra by Dora Larsen,FOREST,Lingerie,70,"S,M,L","S,M,L",US TOPSHOP,Topshop US,"Forset green mesh, maroon elastic and pale sage lace triangle bra by Dora Larsen. 85% Nylon,15% Elastane. Machine wash.",Triangle Bra by Dora Larsen,NULL,NULL,26-04-20 19:42
Bikini Knickers by Tommy Hilfiger,NAVY BLUE,Lingerie,28,"XS,S,M,L,XL","XS,S,M,XL",US TOPSHOP,Topshop US,"Look to an iconic brand to elevate your under layers. These navy blue knickers by Tommy Hilfiger feature the label’s iconic branding to the waistband. Matches with bralet. 94% Cotton, 6% Elastane. Machine wash.",Bikini Knickers by Tommy Hilfiger,NULL,NULL,26-04-20 19:42
Logo V-Back Mesh Bra by Ivy Park,FUCHSIA,Lingerie,36,"XXS,XS,S,M,L,XL","XXS,XS,S,M,L,XL",US TOPSHOP,Topshop US,"This fuchsia pink mesh bra is a testament to the Ivy Park vision of fashionable sportswear with functional features. Created for mid-impact workouts, it boasts breathable, quick-drying fabric to wick sweat away from the body. Its contoured power mesh lining is underpinned by wide straps for additional support. Complete with a logo print stretch waistband, it can be worn under tops or on its own for a statement gym look. 79% Polyester, 21% Elastane. Machine wash.",Logo V-Back Mesh Bra by Ivy Park,NULL,NULL,26-04-20 19:42
Lace Triangle Bra,EMERALD,Lingerie,26,"2,4,6,8,10,12,14","4,6,8,10",US TOPSHOP,Topshop US,"This elegant emerald lace triangle bra comes with a functional front clasp fastening. 89% Polyamide, 11% Elastane. Machine wash.",Lace Triangle Bra,NULL,NULL,26-04-20 19:42
MATERNITY Multi Pack Knickers,MULTI,Lingerie,22,"4,6,8,10,12","4,6,8,10,12",US TOPSHOP,Topshop US,"Maternity multi pack knickers. 60% Polyamide, 32% Polyester, 8% Elastane. Machine wash.",MATERNITY Multi Pack Knickers,NULL,NULL,26-04-20 19:42
Modern Cotton Bikini Briefs by Calvin Klein,Grey Marl,Lingerie,35,"XS,S,M,L,XL","S,M,L",US TOPSHOP,Topshop US,"Modern cotton bikini briefs by Calvin Klein Underwear. 53% Cotton, 35% Modal, 12% Elastane. Machine wash.",Modern Cotton Bikini Briefs by Calvin Klein,NULL,NULL,26-04-20 19:42
Topshop Logo Seamless Thong,Bright Coral,Lingerie,10,"S,M,L","S,M,L",US TOPSHOP,Topshop US,"Bright coral seamless sporty thong with 'Topshop' logo detail. 49% Nylon, 39% Polyester, 12% Elastane. Machine wash.",Topshop Logo Seamless Thong,NULL,NULL,26-04-20 19:42
Floral Lace Balcony Bra,BURNT ORANGE,Lingerie,35,"32A,32B,32C,32D,32DD,34A,34B,34C,34D,34DD,36A,36B,36C,36D","32A,32B,32C,32D,32DD,34A,34B,34C,34D,36A,36C,36D",US TOPSHOP,Topshop US,"Lightly padded with underwired cups for shape and support, this burnt orange lace balcony bra will be an instant favourite. 90% Polyamide, 10% Elastane. Machine wash.",Floral Lace Balcony Bra,NULL,NULL,26-04-20 19:42
Lace Knickers,CORAL,Lingerie,10,"2,4,6,8,10,12,14","2,4,6,8,12",US TOPSHOP,Topshop US,"These coral lace mini knickers make a great update to your underwear drawer. Sheer fabric and a cut at the back mean these flattering pants will make you feel confident in any outfit. 89% Nylon, 11% Elastane. Machine wash.",Lace Knickers,NULL,NULL,26-04-20 19:42
Ombre Mini Knickers,INDIGO,Lingerie,10,"2,4,6,8,10","2,4,6,8,10",US TOPSHOP,Topshop US,"Indigo ombre mini knickers. 94% Polyamide, 6% Elastane. Machine wash.",Ombre Mini Knickers,NULL,NULL,26-04-20 19:42
All Over Lace Ladypants,IVORY,Lingerie,10,"2,4,6,8,10,12,14","2,4,6,8,10,12",US TOPSHOP,Topshop US,"Low rise ladypants with medium coverage. 89% Polyamide, 11% Elastane. Machine wash.",All Over Lace Ladypants,NULL,NULL,26-04-20 19:42
MATERNITY Floral Embroidery Knickers,MULTI,Lingerie,20,"4,6,8,10,12","4,6,8,10,12",US TOPSHOP,Topshop US,"Inspired by a wild meadow, these flattering maternity knickers are comfortable and elegant with floral embroidery on the front. 90% Polyamide, 10% Elastane. Machine wash.",MATERNITY Floral Embroidery Knickers,NULL,NULL,26-04-20 19:42
MATERNITY Lace Mesh Mini Panties,BLACK,Lingerie,15,"4,6,8,10,12","4,6,8,10,12",US TOPSHOP,Topshop US,"These pretty maternity panties come in a soft lace mesh finish, detailed with a sweet bow trim. 90% Polyamide, 10% Elastane. Machine wash.",MATERNITY Lace Mesh Mini Panties,NULL,NULL,26-04-20 19:42
MATERNITY Floral Embroidery Bra,MULTI,Lingerie,40,"34B,34C,34D,34DD,36B,36C,36D,36DD","34C,34D,34DD,36B,36C,36D,36DD",US TOPSHOP,Topshop US,"Inspired by a wild meadow, this flattering maternity bra is supportive and elegant with floral embroidery on the front. 90% Polyamide, 10% Elastane. Machine wash.",MATERNITY Floral Embroidery Bra,NULL,NULL,26-04-20 19:42
