product_name,color,product_category,mrp,total_sizes,available_size,brand_name,retailer,description,pdp_url,rating,review_count,scrapping_datetime
MATERNITY Crop Nursing Bra,WHITE,Lingerie,20,"4,6,8,10,12","4,6,8,10,12",US TOPSHOP,Topshop US,"Still-Bustier. 92 % Baumwolle, 8 % Elastan. Maschinenwäsche.",MATERNITY Crop Nursing Bra,NULL,NULL,26-04-20 19:42
Branded Waistband Jersey Boyshorts,Grey Marl,Lingerie,10,"2,4,6,8,10,12,14","2,4,6,8,10,12",US TOPSHOP,Topshop US,"Graumelierte Boyfriend-Jerseyshorts im 90er-Jahre-Stil. 85 % Baumwolle, 8 % Polyester, 7 % Elastan. Maschinenwäsche.",Branded Waistband Jersey Boyshorts,NULL,NULL,26-04-20 19:42
Varsity Thong by Tommy Hilfiger,NAVY BLUE,Lingerie,28,"XS,S,M,L","XS,S,M,L",US TOPSHOP,Topshop US,"Navy blue varsity thong by Tommy Hilfiger. 76% Polyamide, 19% Elastane, 5% Viscose. Machine wash.",Varsity Thong by Tommy Hilfiger,NULL,NULL,26-04-20 19:42
MATERNITY Criss Cross Knickers,RASPBERRY,Lingerie,20,"4,6,8,10,12","4,6,8,10,12",US TOPSHOP,Topshop US,"These feminine raspberry knickers for maternity feature a criss cross detailing that adds a stylish hint to your under layer. Pair with the matching criss cross bra for a polished co-ord. 78% Polyamide, 22% Elastane. Machine wash.",MATERNITY Criss Cross Knickers,NULL,NULL,26-04-20 19:42
MATERNITY Criss Cross Bra,WHITE,Lingerie,38,"34B,34C,34D,34DD,36B,36C,36D,36DD","34D,34DD,36B,36C",US TOPSHOP,Topshop US,"Balancing comfort and support, this criss cross bra in white for maternity is the perfect update for your under layer. Pair with the matching criss cross knickers for a polished co-ord. 78% Polyamide, 22% Elastane. Machine wash.",MATERNITY Criss Cross Bra,NULL,NULL,26-04-20 19:42
Striped Push Up Bra by Tommy Hilfiger,RED,Lingerie,68,"32A,32B,32C,32D,34A,34B,34C,34D,36A,36B,36C,36D","32B,32C,32D,34A,34B,34C,34D,36B,36C,36D",US TOPSHOP,Topshop US,"Red striped push up bra by Tommy Hilfiger. 74% Polyamide, 26% Elastane. Machine wash.",Striped Push Up Bra by Tommy Hilfiger,NULL,NULL,26-04-20 19:42
MATERNITY Multi Pack Crop Bra Top,MULTI,Lingerie,35,"4,6,8,10,12","4,6,8,12",US TOPSHOP,Topshop US,"Maternity multi pack crop bra top. 60% Polyamide, 32% Polyester, 8% Elastane. Machine wash.",MATERNITY Multi Pack Crop Bra Top,NULL,NULL,26-04-20 19:42
Lace Thongs,Dark Nude,Lingerie,10,"2,4,6,8,10,12,14","4,8,12",US TOPSHOP,Topshop US,"Dark nude pretty lace thong. 89% Nylon, 11% Elastane. Machine wash.",Lace Thongs,NULL,NULL,26-04-20 19:42
MATERNITY Lace And Mesh Mini Panties,IVORY,Lingerie,15,"4,6,8,10,12","4,6,8,10,12",US TOPSHOP,Topshop US,"Keep comfy throughout your pregnancy in these Maternity stretchy lace and mesh panties. 90% Polyamide, 10% Elastane. Machine wash.",MATERNITY Lace And Mesh Mini Panties,NULL,NULL,26-04-20 19:42
Bikini Knickers by Dora Larsen,LAVENDER,Lingerie,60,"XS,S,M,L","S,M,L",US TOPSHOP,Topshop US,"Peckham-based lingerie brand Dora Larsen has created an intricate underwear collection devoted to the art of colour combinations. These gorgeous bikini knicker come in a lavender mesh, complete with orchid elastic and orange lace detail. 85% Nylon,15% Elastane. Machine wash.",Bikini Knickers by Dora Larsen,NULL,NULL,26-04-20 19:42
Longline Padded Bralet,IVORY,Lingerie,30,"2,4,6,8,10,12,14","2,4,6,8,10,12,14",US TOPSHOP,Topshop US,"Keep your cropped styles looking luxe with this delicate lace longline padded bralet in ivory. We’re styling with a frill denim skirt for a look that can be transitioned from day to night. 86% Nylon, 14% Elastane. Machine wash.",Longline Padded Bralet,NULL,NULL,26-04-20 19:42
Premium Embellished Mini Knickers,CHARCOAL,Lingerie,22,"2,4,6,8,10,12,14","2,4,6,8,10,12,14",US TOPSHOP,Topshop US,"Premium charcoal mini knickers with applique and strap detailing. 84% Polyamide, 16% Elastane. Machine wash.",Premium Embellished Mini Knickers,NULL,NULL,26-04-20 19:42
MATERNITY Criss Cross Knickers,WHITE,Lingerie,20,"4,6,8,10,12","4,6,8,10,12",US TOPSHOP,Topshop US,"Überkreuzter Umstandsslip. 78 % Polyamid, 22 % Elastan. Maschinenwäsche.",MATERNITY Criss Cross Knickers,NULL,NULL,26-04-20 19:42
Mesh Lace Trim Mini Knickers,Bubblegum,Lingerie,10,"2,4,6,8,10,12,14","2,4,6,8,10,12,14",US TOPSHOP,Topshop US,"This bubblegum pink mini knickers come in a mesh design with a pretty lace trim. 89% Nylon, 11% Elastane. Machine wash.",Mesh Lace Trim Mini Knickers,NULL,NULL,26-04-20 19:42
Bralet by Dora Larsen,LAVENDER,Lingerie,110,"32A,32B,32C,32D,32DD,34A,34B,34C,34D,34DD,36B,36C","32A,32B,32C,32D,34A,34B,34C,34D,36C",US TOPSHOP,Topshop US,"Peckham-based lingerie brand Dora Larsen has created an intricate underwear collection devoted to the art of colour combinations. This gorgeous bra comes in a lavender mesh, complete with orchid elastic and orange lace detail. 85% Nylon, 15% Elastane. Machine wash.",Bralet by Dora Larsen,NULL,NULL,26-04-20 19:42
Contrast Waist Mini Knickers,CHARTREUSE,Lingerie,10,"2,4,6,8,10,12,14","2,4,6,8,14",US TOPSHOP,Topshop US,"Add a colour pop to your underwear drawer with these chartreuse lace mini knickers with charcoal contrast waistband. Complete the look with the matching bra. 87% Nylon, 13% Elastane. Machine wash.",Contrast Waist Mini Knickers,NULL,NULL,26-04-20 19:42
MATERNITY Criss Cross Bra,RASPBERRY,Lingerie,38,"34B,34C,34D,34DD,36B,36C,36D,36DD","34C,34D,34DD,36B,36C",US TOPSHOP,Topshop US,"Balancing comfort and support, this criss cross bra in raspberry for maternity is the perfect update for your under layer. Pair with the matching criss cross knickers for a polished co-ord. 78% Polyamide, 22% Elastane. Machine wash.",MATERNITY Criss Cross Bra,NULL,NULL,26-04-20 19:42
Crochet Lace Brazilian Knickers,KHAKI,Lingerie,10,"2,4,6,8,10,12,14","4,6,8,10",US TOPSHOP,Topshop US,"Low rise lace Brazilian knickers with an elastic free leg-line for a seamless fit. 88% Polyamide, 12% Elastane. Machine wash.",Crochet Lace Brazilian Knickers,NULL,NULL,26-04-20 19:42
Lace Triangle Bra,BLACK,Lingerie,26,"4,6,8,10,12,14,2","8,10,2",US TOPSHOP,Topshop US,"Black lace triangle bra. 89% Polyamide, 11% Elastane. Machine wash.",Lace Triangle Bra,NULL,NULL,26-04-20 19:42
Branded Waistband Jersey Boyshorts,BLACK,Lingerie,10,"2,4,6,8,10,12,14","2,4,6,8,10,12",US TOPSHOP,Topshop US,"These black '90s style boyshorts come in stretchy jersey cotton fabric with a branded waistband. 91% Cotton, 9% Elastane. Machine wash.",Branded Waistband Jersey Boyshorts,NULL,NULL,26-04-20 19:42
MATERNITY Criss Cross Bra,TEAL,Lingerie,38,"34B,34C,34D,34DD,36B,36C,36D,36DD","34B,34C,34D,34DD,36B,36C,36DD",US TOPSHOP,Topshop US,"Balancing comfort and support, this criss cross bra in teal for MATERNITY is the perfect update for your under layer. Pair with the matching criss cross knickers for a polished co-ord. 78% Polyamide, 22% Elastane. Machine wash.",MATERNITY Criss Cross Bra,NULL,NULL,26-04-20 19:42
'Topshop' Logo Seamless Bra,Bright Coral,Lingerie,20,"S,M,L","S,M,L",US TOPSHOP,Topshop US,"Fancy going seam-free for summer? This pretty coral seamless sports bra with 'Topshop' logo is a wardrobe staple this season. It's so good, we've put our name on it. 85% Polyamide, 13% Polyester, 2% Elastane. Machine wash.",'Topshop' Logo Seamless Bra,NULL,NULL,26-04-20 19:42
Triangle Bra by Bonds,Monochrome,Lingerie,28,"4,6,8,10","6,8,10",US TOPSHOP,Topshop US,"This monochrome triangle bra by Bonds is an essential t-shirt bra. White soft cups and medium support, it is best paired with the matching Bonds knickers. 95% Cotton, 5% Elastane. Machine wash.",Triangle Bra by Bonds,NULL,NULL,26-04-20 19:42
Lace Mini Knickers,MAUVE,Lingerie,10,"2,4,6,8,10,12,14","2,4,8,10,12,14",US TOPSHOP,Topshop US,"Mauve mini knickers with geometric lace. 87% Nylon, 13% Elastane. Machine wash.",Lace Mini Knickers,NULL,NULL,26-04-20 19:42
Lace Triangle Bra,SLATE,Lingerie,26,"2,4,6,8,10,12,14","2,4,6,8,10",US TOPSHOP,Topshop US,"This sophisticated slate blue lace triangle bra comes with a functional front clasp fastening. 89% Polyamide, 11% Elastane. Machine wash.",Lace Triangle Bra,NULL,NULL,26-04-20 19:42
Bralet by Tommy Hilfiger,RED,Lingerie,45,"S,M,L","S,M,L",US TOPSHOP,Topshop US,"Red cotton bralet by Tommy Hilfiger. 90% Polyester, 10% Elastane. Machine wash.",Bralet by Tommy Hilfiger,NULL,NULL,26-04-20 19:42
**Halterneck Bra by Y.A.S,BLACK,Lingerie,26,"XS,S,M,L,XL","XS,XL",US TOPSHOP,Topshop US,"Black halterneck bra. 92% Nylon, 8% Elastane. Machine wash.",**Halterneck Bra by Y.A.S,NULL,NULL,26-04-20 19:42
Thong by by Mimi Holliday,Pink,Lingerie,40,"XS,S,M,L","XS,S,M,L",US TOPSHOP,Topshop US,Pink thong by Mimi Holliday. 100% Nylon. Machine wash.,Thong by by Mimi Holliday,NULL,NULL,26-04-20 19:42
Lace Mini Knickers,ORANGE,Lingerie,10,"2,4,6,8,10,12,14","2,4,6,8,10,12",US TOPSHOP,Topshop US,"Orange lace mini knickers. 89% Nylon, 11% Elastane. Machine wash.",Lace Mini Knickers,NULL,NULL,26-04-20 19:42
Plunge T-Shirt Bra,BLACK,Lingerie,35,"32A,32B,32C,32D,32DD,34A,34B,34C,34D,34DD,36A,36B,36C,36D","32A,32B,32C,32D,34A,34B,34C,34D,34DD,36B,36D",US TOPSHOP,Topshop US,"Plunge t-shirt bra with smooth pad for extra support and print detail on inner cup. 81% Polyamide, 19% Elastane. Machine wash.",Plunge T-Shirt Bra,NULL,NULL,26-04-20 19:42
Lace Thong,Dark Nude,Lingerie,10,"2,4,6,8,10,12,14","2,4,6,8,10,12,14",US TOPSHOP,Topshop US,"Keep fitted silhouettes seam-free with this pretty nude lace thong underneath. A semi-sheer style with a low rise fit. 89% Nylon,11% Elastane. Machine wash.",Lace Thong,NULL,NULL,26-04-20 19:42
Topshop Branded Jersey Mini Knickers,GREY,Lingerie,10,"2,4,6,8,10,12,14","2,4,6,8,10,14",US TOPSHOP,Topshop US,"These sporty grey jersey mini knickers come with a stylish branded waistband in black. 60% Polyamide, 32% Polyester, 8% Elastane. Machine wash.",Topshop Branded Jersey Mini Knickers,NULL,NULL,26-04-20 19:42
Triangle Lace Bra by Bonds,Flur Pink,Lingerie,28,"4,6,8,10","4,6,8",US TOPSHOP,Topshop US,"Fleuro pink lace triangle bra by Bonds. 94% Nylon,6% Elastane. Machine wash.",Triangle Lace Bra by Bonds,NULL,NULL,26-04-20 19:42
Mini Knickers by Mimi Holliday,Pink,Lingerie,45,"XS,S,M,L","XS,S,M,L",US TOPSHOP,Topshop US,Pink mini knickers by Mimi Holliday. 100% Nylon. Machine wash,Mini Knickers by Mimi Holliday,NULL,NULL,26-04-20 19:42
Balcony Bra by Mimi Holliday,Pink,Lingerie,75,"32B,32C,32D,34A,34B,34C,34D,36A,36B","34B,34C,36B",US TOPSHOP,Topshop US,Pink balcony bra by Mimi Holliday. 100% Nylon. Machine wash.,Balcony Bra by Mimi Holliday,NULL,NULL,26-04-20 19:42
MATERNITY Criss Cross Knickers,TEAL,Lingerie,20,"4,6,8,10,12","4,6,8,10,12",US TOPSHOP,Topshop US,"These feminine teal knickers for maternity features a criss cross detailing that adds a stylish hint to your under layer. Pair with the matching criss cross bra for a polished co-ord. 78% Polyamide, 22% Elastane. Machine wash.",MATERNITY Criss Cross Knickers,NULL,NULL,26-04-20 19:42
Lace Mini Knickers,FOREST,Lingerie,10,"2,4,6,8,10,12,14",14,US TOPSHOP,Topshop US,"Forest lace mini knickers. 89% Nylon, 11% Elastane. Machine wash.",Lace Mini Knickers,NULL,NULL,26-04-20 19:42
Lace Knickers,GINGER,Lingerie,10,"2,4,6,8,10,12,14","2,4,6,8,10,12",US TOPSHOP,Topshop US,"Ginger lace mini knickers. 89% Nylon, 11% Elastane. Machine wash.",Lace Knickers,NULL,NULL,26-04-20 19:42
**Body by Y.A.S,BLACK,Lingerie,60,"XS,S,M,L,XL","XS,S,M,L,XL",US TOPSHOP,Topshop US,"Black body. 92% Nylon, 8% Elastane. Machine wash.",**Body by Y.A.S,NULL,NULL,26-04-20 19:42
Longline Padded Bralet,Dark Nude,Lingerie,30,"2,4,6,8,10,12,14","2,4,6,8,10,12,14",US TOPSHOP,Topshop US,"Keep your cropped styles looking luxe with this delicate lace longline padded bralet in nude. We’re styling with a frill denim skirt for a look that can be transitioned from day to night. 86% Nylon, 14% Elastane. Machine wash.",Longline Padded Bralet,NULL,NULL,26-04-20 19:42
Sporty Branded Bra,Nude,Lingerie,20,"S,M,L","S,L",US TOPSHOP,Topshop US,"Keep your basics looking sporty with this nude bra with Topshop branded detail. Matches with thong. 85% Polyamide, 13% Polyester, 2% Elastane. Machine wash.",Sporty Branded Bra,NULL,NULL,26-04-20 19:42
Twist Halter Bra by Mimi Holliday,BLACK,Lingerie,65,"XS,S,M,L","XS,S,M,L",US TOPSHOP,Topshop US,"Black twist halter bra with cross back by Mimi Holliday. 90% Nylon, 10% Elastane. Machine wash.",Twist Halter Bra by Mimi Holliday,NULL,NULL,26-04-20 19:42
Bikini Knickers by Dora Larsen,FOREST,Lingerie,60,"XS,S,M,L","XS,S,M,L",US TOPSHOP,Topshop US,"Forest green mesh, maroon elastic and pale sage lace bikini knickers by Dora Larsen. 85% Nylon,15% Elastane. Machine wash.",Bikini Knickers by Dora Larsen,NULL,NULL,26-04-20 19:42
Thong by Bluebella,BLACK,Lingerie,26,"4,6,8,10,12","8,10,12",US TOPSHOP,Topshop US,"Schwarzer Tanga von Bluebella. 90 % Polyester, 10 % Elastan. Maschinenwäsche.",Thong by Bluebella,NULL,NULL,26-04-20 19:42
Wireless Bralet by Bonds,Pink,Lingerie,48,"XS,S,M","XS,S,M",US TOPSHOP,Topshop US,"Choose colourful intimates as the seasons change. This wireless bra by Bonds comes in a pretty pink hue with a branded waistband. 95% Cotton, 5% Elastane. Machine wash.",Wireless Bralet by Bonds,NULL,NULL,26-04-20 19:42
Yasallie Mini Knickers by Y.A.S,ROSE,Lingerie,22,"XS,S,M,L,XL","M,L,XL",US TOPSHOP,Topshop US,"Rose mini knickers by Y.A.S. 90% Polyamide, 10% Elastane. Machine wash.",Yasallie Mini Knickers by Y.A.S,NULL,NULL,26-04-20 19:42
Circle Mesh Mini Knickers,BLACK,Lingerie,22,"2,4,6,8,10,12,14","2,4,6,8,10,12,14",US TOPSHOP,Topshop US,"Netzstoffminislip mit Kreismuster. 85 % Polyamid, 15 % Elastan. Maschinenwäsche.",Circle Mesh Mini Knickers,NULL,NULL,26-04-20 19:42
Topshop Branded Mini Knickers,ROSE,Lingerie,10,"2,4,6,8,10,12,14","2,4,6,8,10,12",US TOPSHOP,Topshop US,"Boasting a 'Topshop' branded waistband, these Rose Pink mini knickers are an essential basic. 93% Cotton, 7% Elastane. Machine wash.",Topshop Branded Mini Knickers,NULL,NULL,26-04-20 19:42
'Topshop' Logo Seamless Bra,LILAC,Lingerie,20,"S,M,L","S,M,L",US TOPSHOP,Topshop US,"Fancy going seam-free for summer? This pretty lilac seamless sports bra with 'Topshop' logo is a wardrobe staple this season. It's so good, we've put our name on it. 85% Polyamide, 13% Polyester, 2% Elastane. Machine wash.",'Topshop' Logo Seamless Bra,NULL,NULL,26-04-20 19:42
Triangle Bra by Mimi Holliday,Pink,Lingerie,68,"XS,S,M,L","XS,S,M,L",US TOPSHOP,Topshop US,Pink triangle bra by Mimi Holliday. 100% Nylon. Machine wash.,Triangle Bra by Mimi Holliday,NULL,NULL,26-04-20 19:42
Topshop Branded Sporty Bralet,ROSE,Lingerie,15,"2,4,6,8,10,12,14","6,8,10",US TOPSHOP,Topshop US,"Sporty bralet with a topshop branded contrast underband. 93% Cotton, 7% Elastane. Machine wash.",Topshop Branded Sporty Bralet,NULL,NULL,26-04-20 19:42
**Brazilian Knickers by Y.A.S,BLACK,Lingerie,15,"XS,S,M,L,XL","S,L,XL",US TOPSHOP,Topshop US,"Black brazilian knickers. 92% Nylon, 8% Elastane. Machine wash.",**Brazilian Knickers by Y.A.S,NULL,NULL,26-04-20 19:42
Lace Shortie Knickers by Bonds,Blush,Lingerie,26,"4,6,8,10","4,6,8,10",US TOPSHOP,Topshop US,"Blush lace shortie knickers by Bonds. 88% Nylon,12% Elastane. Machine wash.",Lace Shortie Knickers by Bonds,NULL,NULL,26-04-20 19:42
Boho Lace Triangle Bra by Bonds,Sugar Pink,Lingerie,28,"4,6,8,10","4,6,8,10",US TOPSHOP,Topshop US,"This pull-on pink triangle bra by Bonds will prettify your underwear draw. It features a charming lace design with stretchy straps. 94% Nylon, 6% Elastane. Machine wash.",Boho Lace Triangle Bra by Bonds,NULL,NULL,26-04-20 19:42
Lace Mini Knickers,AQUA,Lingerie,10,"2,4,6,8,10,12,14","2,4,6,8,10,12",US TOPSHOP,Topshop US,"Aqua lace mini knickers. 89% Nylon, 11% Elastane. Machine wash.",Lace Mini Knickers,NULL,NULL,26-04-20 19:42
Bra by Mimi Holliday,Pink,Lingerie,75,"32B,32C,32D,34B,34C,34D,36B,36C","32D,34B,36B",US TOPSHOP,Topshop US,Rosa BH von Mimi Holliday. 100 % Nylon. Maschinenwäsche.,Bra by Mimi Holliday,NULL,NULL,26-04-20 19:42
Seamless Sporty Thong,WHITE,Lingerie,10,"S,M,L","S,L",US TOPSHOP,Topshop US,"Option for a simple but practical style when choosing underwear with this sporty thong in a low rise fit. 85% Nylon, 14% Elastane, 1% Polyester. Machine wash.",Seamless Sporty Thong,NULL,NULL,26-04-20 19:42
Premium Applique Plunge Bra,CHARCOAL,Lingerie,52,"32A,32B,32C,32D,32DD,34A,34B,34C,34D,34DD,36A,36B,36C,36D","32A,32B,32C,32D,32DD,34A,34B,34C,34D,34DD,36A,36B,36C,36D",US TOPSHOP,Topshop US,"Crafted from layers of charcoal lace, this applique plunge bra is fresh from our Premium range. Featuring adjustable shoulder straps and two waistband straps, it's sure to prettify your lingerie drawer. 100% Polyamide. Machine wash.",Premium Applique Plunge Bra,NULL,NULL,26-04-20 19:42
MATERNITY Criss Cross Bra,BLACK,Lingerie,38,"34B,34C,34D,34DD,36B,36C,36D,36DD",36C,US TOPSHOP,Topshop US,"Balancing comfort and support, this criss cross bra in black for maternity is the perfect update for your under layer. Pair with the matching criss cross knickers for a polished co-ord. 78% Polyamide, 22% Elastane. Machine wash.",MATERNITY Criss Cross Bra,NULL,NULL,26-04-20 19:42
Sporty Branded Thong,Nude,Lingerie,10,"S,M,L","S,M,L",US TOPSHOP,Topshop US,"Keep your basics looking sporty with this nude thong that features Topshop branding detail. 85% Polyamide, 13% Polyester, 2% Elastane. Machine wash.",Sporty Branded Thong,NULL,NULL,26-04-20 19:42
Bikini Knickers by Bonds,RED,Lingerie,28,"4,6,8,10,12","4,6,8,12",US TOPSHOP,Topshop US,"Elevate your intimates with these bikini knickers by Bonds in a red floral print with contrast lining. 95% Cotton, 5% Elastane. Machine wash.",Bikini Knickers by Bonds,NULL,NULL,26-04-20 19:42
Bikini Knickers by Bonds,WHITE,Lingerie,26,"4,6,8,10,12","6,8,10",US TOPSHOP,Topshop US,"Replenish your underwear drawer with these white bikini knickers by Bonds. Their wide band hugs the hips for a comfortable fit. 95% Cotton, 5% Elastane. Machine wash.",Bikini Knickers by Bonds,NULL,NULL,26-04-20 19:42
Lace Mini Knickers by Bonds,Flur Pink,Lingerie,28,"4,6,8,10",4,US TOPSHOP,Topshop US,"Fleuro pink lace bikini knickers by Bonds. 94% Nylon, 6% Elastane. Machine wash.",Lace Mini Knickers by Bonds,NULL,NULL,26-04-20 19:42
Lace Trim Triangle Bra,BLACK,Lingerie,26,"2,4,6,8,10,12,14","2,4,6,8,10,12",US TOPSHOP,Topshop US,"This black triangle bra is adorned with pretty lace to the neckline and waistband. It's perfect for prettifying your lingerie drawer. 88% Polyamide, 12% Elastane. Machine wash.",Lace Trim Triangle Bra,NULL,NULL,26-04-20 19:42
Circle Mesh Bodysuit,BLACK,Lingerie,52,"2,4,6,8,10,12,14","2,4,6,8,10,12,14",US TOPSHOP,Topshop US,"Revamp your lingerie draw with this intricate mesh bodysuit. Styled with wide mesh straps, a deep v-neckline and contrast mesh patterning, you'll want to wear your underwear as outerwear from now on. 85% Polyamide, 15% Elastane. Machine wash.",Circle Mesh Bodysuit,NULL,NULL,26-04-20 19:42
Crochet Lace Brazilian Knickers,IVORY,Lingerie,10,"2,4,6,8,10,12,14",6,US TOPSHOP,Topshop US,"Get glamorous with your underlayer in this low rise lace brazilian knickers. The elastic free leg-line creates a seamless fit. 88% Polyamide, 12% Elastane. Machine wash.",Crochet Lace Brazilian Knickers,NULL,NULL,26-04-20 19:42
Sporty Thong,PALE BLUE,Lingerie,10,"S,M,L","S,M,L",US TOPSHOP,Topshop US,"Pale blue sporty thong. 85% Polyamide, 14% Elastane, 1% Polyester. Machine wash.",Sporty Thong,NULL,NULL,26-04-20 19:42
Triangle Bra by Bonds,RED,Lingerie,28,"4,6,8,10","6,8,10",US TOPSHOP,Topshop US,"Elevate your intimates with this triangle bra by Bonds in a red floral print with contrast lining. 95% Cotton,5% Elastane. Machine wash.",Triangle Bra by Bonds,NULL,NULL,26-04-20 19:42
Twist Knicker by by Mimi Holliday,BLACK,Lingerie,45,"XS,S,M,L","XS,S,M,L",US TOPSHOP,Topshop US,"Black twisted knicker by Mimi Holliday. 90% Nylon,10% Elastane. Machine wash.",Twist Knicker by by Mimi Holliday,NULL,NULL,26-04-20 19:42
Lace Thong by Mimi Holliday,WHITE,Lingerie,45,"L,M,S,XS","S,XS",US TOPSHOP,Topshop US,"A flattering lace scalloped trim thong by Mimi Holliday. 90% Nylon, 10% Elastane. Machine wash.",Lace Thong by Mimi Holliday,NULL,NULL,26-04-20 19:42
Racer Geometric Crop Top Bra by Bonds,Blush,Lingerie,28,"4,6,8,10,12","4,6,8,10,12",US TOPSHOP,Topshop US,"Channel a sporty style in this racer-back crop top bra by Bonds, featuring a geometric floral print and branded underband. 95% Cotton, 5% Elastane. Machine wash.",Racer Geometric Crop Top Bra by Bonds,NULL,NULL,26-04-20 19:42
Lace Triangle Bra by Bonds,TEAL,Lingerie,45,"4,6,8,10","4,6,8,10",US TOPSHOP,Topshop US,"Elevate your intimates with this lace triangle bra by Bonds in teal. 88% Nylon, 12% Elastane. Machine wash.",Lace Triangle Bra by Bonds,NULL,NULL,26-04-20 19:42
Boy-Short Hipster Knickers by Bonds,Pink,Lingerie,20,"4,6,8,10","4,6,8,10",US TOPSHOP,Topshop US,"In a pale pink hue, these boy-short hipster knickers by Bonds feature a stretch logo waistband. 95% Cotton, 5% Elastane. Machine wash.",Boy-Short Hipster Knickers by Bonds,NULL,NULL,26-04-20 19:42
Underwired Geometric Racerback Bra,CHARTREUSE,Lingerie,40,"32A,32B,32C,32D,32DD,32E,34A,34B,34C,34D,34DD,34E,36A,36B,36C,36D,36DD,36E","32A,32B,32C,32D,34A,34B,34C,34D,36A,36B,36C,36D,36DD",US TOPSHOP,Topshop US,"Chartreuse geometric lace underwired bra with racerback detail. 89% Polyamide, 11% Elastane. Machine wash.",Underwired Geometric Racerback Bra,NULL,NULL,26-04-20 19:42
Yasallie Bra by Y.A.S,BLACK,Lingerie,28,"XS,S,M,L,XL","XS,S,M",US TOPSHOP,Topshop US,"A black bra by Y.A.S. 90% Polyamide, 10% Elastane. Machine wash.",Yasallie Bra by Y.A.S,NULL,NULL,26-04-20 19:42
Logo Waistband Bralet by Calvin Klein,KHAKI,Lingerie,58,"XS,S,M,L","S,L",US TOPSHOP,Topshop US,"This classic Calvin Klein bralet is crafted in a soft cotton modal blend with just the right amount of stretch for all day comfort. This khaki style is finished with an iconic branded logo underband. 53% Cotton, 35% Modal, 12% Elastane. Machine wash.",Logo Waistband Bralet by Calvin Klein,NULL,NULL,26-04-20 19:42
Towelling Triangle Bra,Bubblegum,Lingerie,30,"2,4,6,8,10,12,14","2,4,6,8,10,12,14",US TOPSHOP,Topshop US,"This bubblegum pink triangle bra made from soft towelling for the ultimate in comfort. 80% Cotton, 20% Polyester. Machine wash.",Towelling Triangle Bra,NULL,NULL,26-04-20 19:42
Balcony Bra by Dora Larsen,RED,Lingerie,90,"32A,32B,32C,32D,32DD,34A,34B,34C,34D,34DD,36B,36C","32A,32B,34A,34B,34C,36B,36C",US TOPSHOP,Topshop US,"A mint mesh balcony bra by Dora Larsen, with fuchsia elastic and red lace detail. 85% Nylon, 15% Elastane. Machine wash.",Balcony Bra by Dora Larsen,NULL,NULL,26-04-20 19:42
Yasallie Mini Knickers by Y.A.S,BLACK,Lingerie,22,"XS,S,M,L,XL",XL,US TOPSHOP,Topshop US,"Black mini knickers by Y.A.S. 90% Polyamide, 10% Elastane. Machine wash.",Yasallie Mini Knickers by Y.A.S,NULL,NULL,26-04-20 19:42
Padded Lace Triangle Bra,PLUM,Lingerie,30,"2,4,6,8,10,12,14",8,US TOPSHOP,Topshop US,"In a deep plum shade, this elegant padded lace triangle bra boasts a contrast waistband, racerback and adjustable straps. 87% Nylon, 13% Elastane. Machine wash.",Padded Lace Triangle Bra,NULL,NULL,26-04-20 19:42
Velvet Body by Y.A.S,BLACK,Lingerie,48,"XS,S,M,L,XL","XS,S",US TOPSHOP,Topshop US,"Strappy velvet body by Y.A.S. 95% Polyester, 5% Elastane. Machine wash.",Velvet Body by Y.A.S,NULL,NULL,26-04-20 19:42
Bikini Knickers by Bonds,BLACK,Lingerie,26,"4,6,8,10,12","4,6,8",US TOPSHOP,Topshop US,"Black bikini knickers by Bonds. 95% Cotton, 5% Elastane. Machine wash.",Bikini Knickers by Bonds,NULL,NULL,26-04-20 19:42
Padded Triangle Bra,MAUVE,Lingerie,30,"2,4,6,8,10,12,14","6,8,10",US TOPSHOP,Topshop US,"Mauve padded triangle bra with geometric lace. 87% Nylon, 13% Elastane. Machine wash.",Padded Triangle Bra,NULL,NULL,26-04-20 19:42
Sporty Branded Bra,Grey Marl,Lingerie,20,"S,M,L","S,M,L",US TOPSHOP,Topshop US,"Grey marl sporty bra with Topshop branded detail. 49% Polyamide, 39% Polyester, 12% Elastane. Machine wash.",Sporty Branded Bra,NULL,NULL,26-04-20 19:42
Sporty Branded Thong,WHITE,Lingerie,10,"S,M,L","S,M,L",US TOPSHOP,Topshop US,"Opt for a simple but practical style when choosing underwear with this sporty thong in a low rise fit with Topshop branding detail. 85% Polyamide, 14% Elastane, 1% Polyester. Machine wash.",Sporty Branded Thong,NULL,NULL,26-04-20 19:42
Underwired Lace Bra,BURNT ORANGE,Lingerie,35,"34C,34D,36A,36B,36C,32DD,32A,32B,32C,32D,34A,34B","34C,34D,36A,36B,36C,32A,32B,32C,32D,34A,34B",US TOPSHOP,Topshop US,"Underwired lace bra. 89% Nylon, 11% Elastane. Machine wash.",Underwired Lace Bra,NULL,NULL,26-04-20 19:42
Geometric Floral Mini Knickers by Bonds,BLACK,Lingerie,28,"4,6,8,10,12","4,6,8,10,12",US TOPSHOP,Topshop US,"Replenish your underwear drawer with these black geometric floral mini knickers by Bonds. Their wide band hugs the hips for a comfortable fit. 95% Cotton, 5% Elastane. Machine wash.",Geometric Floral Mini Knickers by Bonds,NULL,NULL,26-04-20 19:42
Yasallie Bra by Y.A.S,ROSE,Lingerie,28,"XS,S,M,L,XL","XS,S,M,L,XL",US TOPSHOP,Topshop US,"A rose bra by Y.A.S with a front clasp. 90% Polyamide, 10% Elastane. Machine wash.",Yasallie Bra by Y.A.S,NULL,NULL,26-04-20 19:42
Thong by by Mimi Holliday,AQUA,Lingerie,45,"XS,S,M,L","XS,S,M,L",US TOPSHOP,Topshop US,Aqua lace thong by Mimi Holliday. 100% Nylon. Machine wash.,Thong by by Mimi Holliday,NULL,NULL,26-04-20 19:42
Triangle Bra by Dora Larsen,RED,Lingerie,70,"S,M,L","S,M,L",US TOPSHOP,Topshop US,"A mesh triangle bra by Dora Larsen, with fuschia elastic and a red lace trim. 85% Nylon, 15% Elastane. Machine wash.",Triangle Bra by Dora Larsen,NULL,NULL,26-04-20 19:42
MATERNITY Geometric Mesh Print Knickers,BLACK,Lingerie,20,"4,6,8,10,12","4,6,8,10,12",US TOPSHOP,Topshop US,"These black mesh maternity knickers come in a geometric print with sheet inserts to the side. 81% Polyester, 19% Elastane. Machine wash.",MATERNITY Geometric Mesh Print Knickers,NULL,NULL,26-04-20 19:42
